id,title,score,author,num_comments,created,selftext,permalink
1lt1ecf,La gran decisión de Evelyn Matthei - La Tercera,6,1750gt16,14,2025-07-06 14:35:06,"La gran definición política que enfrenta Evelyn Matthei es si gira hacia el centro, e incluso a la centroizquierda, o no.

Esa es la encrucijada de fondo que se ha tomado la discusión al interior de Chile Vamos y del comando de la exalcaldesa.

La opción se empezó a sopesar antes de las primarias, cuando los sondeos empezaron a dar por ganadora a la abanderada del PC, **Jeannette Jara**, cuyo triunfo dejó huérfano al centro político. Y la visibilizó este viernes **Juan Luis Ossa**, coordinador programático de la exedil, en *Desde La Redacción* de **La Tercera**, al plantear que “hay que hablarle al centro e incluso a la centroizquierda que está desencantada”.

Pero no hay acuerdo.

En el corazón de la campaña admiten que, además de Ossa, personeros influyentes, como los exsubsecretarios **Rodrigo Ubilla** y **Claudio Alvarado,** comparten la misma tesis política. Y que otros, como la periodista **Fernanda Otero** y el extimonel UDI **Ernesto Silva,** tienen otra visión. Por ejemplo, que el centro político se vació y que, si bien hay que elegir un posicionamiento, este debiera darse no en clave política, sino que conectando con los principales problemas de las personas.

Pero sí coinciden en dos puntos: en que es imposible que Matthei crezca hacia la derecha más dura, porque ese espacio está ocupado hasta el último milímetro por el republicano **José Antonio Kast** y **Johannes Kaiser,** de Nacional Libertarios, y que los cinco puntos que le arrebataron en los últimos sondeos son prácticamente irrecuperables.

Como contrapartida, hacen ver que la exedil tiene a su haber el hecho de ser la única abanderada de derecha que puede captar el voto del centro -el voto moderado- y también el sufragio de una parte del Socialismo Democrático que quedó sin representación tras la derrota de **Carolina Tohá**, donde observan que si bien no están dispuestos a salir del clóset, sí podrían sufragar por ella sin problemas en la reserva de la urna de votación.

De ahí que se esté poniendo especial atención a los análisis de figuras del Socialismo Democrático, entre ellas **Ernesto Ottone** \-quien ha dicho por estos días que “no se puede ser demócrata y marxista leninista”-, para conocer el virtual comportamiento de ese sector.

Los riesgos que avizoran para dar el giro no son menores. El principal es la pérdida de parte del electorado de Chile Vamos, cuyas bases son celosamente de derecha, con lo que un viraje de ese calibre podría arriesgar entregarle las llaves de ese sector a Kast. Por eso se habla de que es una definición “estructural”, que requiere de “coraje político” y que involucra estructuralmente a los tres partidos de la coalición.

A ello obedece la tensión.

De ahí que el presidente de la UDI, **Guillermo Ramírez**, saliera a afrontar la disyuntiva bajo el siguiente principio: “Evelyn Matthei es una mujer de derecha, con ideas de derecha, pero que entiende que en las reformas importantes es necesario construir grandes mayorías”, dijo a El Dínamo. Y que “esa ponderación y capacidad de escucha de las ideas del adversario le hacen sentido a un mundo moderado”.

Para el comando -en este minuto- la campaña se juega en la calle y también en la élite, donde buscan resguardar la candidatura de Matthei. Por ello consideran fundamental como señal política el apoyo otorgado por figuras de la ex Concertación, como **René Cortázar**, **Mariana Aylwin, José Pablo Arellano, Jorge Schaulsohn, Jorge Burgos, Pablo Piñera, Pedro García** y **Clemente Pérez**, y el respaldo de Amarillos. Flujo que esperan que continúe con Demócratas y su precandidata presidencial, la senadora **Ximena Rincón**.

“Esto se va a ganar en el terreno. Va a haber que correr por dos caminos: mantener a la gente de derecha y centroderecha, porque uno no puede renunciar a sus principios y valores, y también crecer hacia el centro”, sostiene el diputado UDI **Juan Manuel Fuenzalida**.

Si bien en Chile Vamos existe la convicción de que cuentan con la mejor carta a la Presidencia, apuntan sus dardos a la falta de una estrategia clara. Y sostienen, incluso, que el diseño se parece más a una campaña municipal que a una presidencial.

“No resistimos dos semanas más a la baja”, enfatiza una fuente, que reclama decisiones profundas y rápidas.

La inquietud la visibilizó públicamente **Pablo Longueira** \-el histórico excoronel de la UDI-, quien aparte de plantear la idea de ir derechamente por un gobierno de unidad nacional, alertó que Matthei “tiene 15 días muy decisivos” para posicionar su opción.

En el comando -sin embargo- los plazos son más amplios. Hablan de julio como el mes clave, por la presión, además, que van a empezar a imponer los candidatos al Parlamento.

# La cita en el O’Higgins

El martes 1 de julio -cuando ya se habían masticado los resultados de las primarias oficialistas-, **Matthei** llegó hasta el histórico restaurante O’Higgins, ubicado al frente del Congreso, en Valparaíso, para marcar el puntapié de la recta final de su campaña a La Moneda, junto a los diputados de Chile Vamos. “Estoy convencida de que vamos a ganar”, les dijo.

Pero esa noche entre los asistentes había preocupación.

La baja en las encuestas, que ya acumula cuatro semanas, está generando un fuerte ruido en las bancadas de los tres partidos de Chile Vamos. Las cuentas indican que falta un poco más de cuatro meses para la primera vuelta y, por tanto, un escaso tiempo para revertir la tendencia que muestran los sondeos.

“La idea era entregarle nuestro apoyo incondicional, cosa que hicimos, pero también decirle la verdad, que el asunto no estaba bien”, comenta una fuente.

Pero todo se frenó tras la intervención del diputado y jefe de bancada de RN **Miguel Mellado**, quien le expresó con franqueza sus aprensiones por el rumbo de la campaña. De acuerdo a distintas fuentes -el parlamentario declinó pronunciarse sobre este episodio-, le hizo ver que no había relato; que no era conveniente que ella hablara siempre, porque eso la exponía y la llevaba a equivocaciones, y que los voceros se querían llevar la pelota para la casa.

Eso molestó a Matthei. Algunos presentes relatan que la candidata -a quien algunos han visto bajo más presión- no ocultó su incomodidad y reaccionó diciendo que no iba a permitir ese tipo de cuestionamientos.

“Con esa parada de carros, nadie se atrevió a criticar nada más”, comenta un parlamentario.

# La estrategia

Pese a los tironeos por un cambio de rumbo, en la sede central del comando de Matthei -en Enrique Foster, Las Condes- se asegura que la estrategia gruesa se mantiene sin grandes variaciones, salvo la decisión táctica de diferenciarse de Kast y de Jara, sin entrar en disputas.

Bajo esos lineamientos, la performance de la recta final se inauguró la misma noche de las primarias, día en que la exalcaldesa apareció rodeada de mujeres, apuntando al voto femenino, que es esquivo para Kast y donde Jara tiene llegada. Una estrategia que reforzó hacia ese electorado esta semana con el aterrizaje de la exsubsecretaria de Salud Pública **Paula Daza**, como vocera.

Pero el asunto ha tenido traspiés. Partiendo porque para muchos en Chile Vamos Matthei perdió una oportunidad única para presentarse esa noche ante el país como la abanderada que le iba a impedir al gobierno de **Gabriel Boric** su continuidad y también para hacer una invitación amplia al cambio. Y, luego, por el error de calificar a Johannes Kaiser como “mucho más respetuoso de las mujeres que Kast, porque tiene una cosa mucho más liberal”, olvidando que el libertario tiene un amplio registro en redes sociales con frases polémicas hacia las mujeres, que incluso lo apartaron de republicanos en la campaña de 2021 para no perjudicar a Kast.

Aparte de las mujeres, el diseño del comando apunta a los jóvenes -pues los datos internos indican que se están yendo más con Kaiser, quien ha capitalizado la rabia ante la delincuencia y la falta de oportunidades-, y a los independientes que el 16 de noviembre irán obligados a votar. El foco es seguridad, migración, crecimiento económico y agenda laboral, donde no solo se espera un choque entre Matthei y Jara, pues ambas fueron ministras del Trabajo, sino que también a nivel de habilidades blandas, en la que ambas tienen destrezas y han marcado estilos.

“Las encuestas son volátiles e incluso contradictorias. Lo importante aquí es que somos la coalición más gravitante de la derecha, con una relevante fuerza territorial en parlamentarios, gobernadores, alcaldes, concejales y cores. Y lo que viene, de ahora en adelante, es un gran despliegue de Evelyn Matthei, quien en estos días se encuentra en La Araucanía, y también de Chile Vamos, para dar a conocer nuestras propuestas en cada rincón de Chile. Eso va a marcar la diferencia”, sostiene el diputado de Evópoli Francisco Undurraga.

# La apuesta de Kast

Quien no está dispuesto a variar su diseño de campaña -que le ha permitido encumbrarse en los primeros lugares de las encuestas- es **José Antonio Kast**. No han definido todavía si van a inscribir la candidatura antes del cierre del plazo, el próximo 18 de agosto. Pero sí están claros en que el esquema sigue invariable en seguridad, migración ilegal y crecimiento económico.

“Lo único que ha cambiado es que ahora tenemos un adversario conocido en el oficialismo. Pero no vamos a hacer foco en el tema de si Jeannette Jara es comunista o no, porque eso es parte del inventario. Sí en que es continuadora de este gobierno. Pero nuestra hoja de ruta no se altera ni por los candidatos que tenemos al frente, ni por las encuestas, ni por el resultado de las primarias”, dice una fuente.

Tampoco están dispuestos a tener disputas con Matthei ni a caer en provocaciones. “Sabemos -asegura una fuente- que ella cambió de estrategia y nuestra estrategia es no hacernos cargo de su estrategia”.

Prueba de ello es que Kast solo sostuvo que “no voy a marcar la diferencia con alguien que es opositor al gobierno”, por la comparación que hizo la exedil con Kaiser sobre la píldora anticonceptiva.

Ya pusieron en marcha la maquinaria territorial, que cuenta con casi una decena de alcaldes, más de 300 concejales y unos 60 consejeros regionales. Y están en plena negociación de la plantilla parlamentaria con los Nacional Libertarios y Social Cristianos, partido que depuso la candidatura de **Francesca Muñoz** el domingo, tras conocerse la victoria de Jara.

# La batalla de Kaiser

El plan de Nacional Libertarios, en tanto, es convertir a Kaiser en el rostro que enfrentará al Partido Comunista y a Jara en esta presidencial.

Una estrategia que le puede acarrear costos electorales, pero que también -estiman- los puede beneficiar.

En esas filas hay claridad de que al presentarse en una línea más extrema, el mayor beneficiado podría ser Kast, porque quedaría en una postura más moderada. Pero -afirman- que no están haciendo ese tipo de cálculos.

“Siempre planteamos que íbamos a iniciar nuestra campaña cuando tuviéramos al frente a la persona que ganara la primaria del oficialismo. Ganó la exministra Jara, del Partido Comunista, y vamos a dar una batalla cultural. Estamos dispuestos a ese desafío”, sostiene **Cristián Labbé**, jefe de campaña del abanderado nacional libertario.

El diseño contempla la proclamación de Kaiser -el próximo 12 de julio, con asistencia presencial y telemática para incluir a las regiones-, donde se va a dar a conocer el plan de gobierno, las propuestas y los equipos de trabajo.

En este complejo escenario, los comandos están ajustando sus piezas para la recta final, en la que Matthei y Kast disputan no solo el voucher para la segunda vuelta presidencial, sino que también la hegemonía de la derecha.",https://reddit.com/r/RepublicadeChile/comments/1lt1ecf/la_gran_decisión_de_evelyn_matthei_la_tercera/
1lruo46,Un análisis de entrevistas de Johannes Kaiser (+/- últimos 6 meses),4,i4bimmer,9,2025-07-04 23:06:21,"Con motivo de la entrevista de Moschiatti a Johannes Kaiser, se me ocurrió hacer un análisis **rápido, no exhaustivo** usando NotebookLM y Gemini.  Básicamente, agregué unos 40 videos de entrevistas de los últimos 6 meses a NotebookLM y generé 3 análisis:

**Prompts en NotebookLM:**

1: What are the main political, economic and philosophical principles promoted and defended by Johannes Kaiser

2: Contrast the economic, political and philosophical principles promoted by Jonannes Kaiser with those promoted by Communism in its classic form

3: Qué dice Johannes Kaiser con respecto a los derechos y deberes de las mujeres?

Las respuestas a estos prompts las usé como input para Gemini.

**Prompts en Gemini:**

1:  What are the main political, economic and philosophical principles promoted and defended by Johannes Kaiser

2: Considering the following principles promoted by the Chilean politician Johannes Kaiser, compare them to those promoted by classical Communism, such as those promoted by the Communist party in Chile. Give the output in Spanish.

3: Now do the same but comparing it to the principles promoted by the National Socialism (Nazism). Could Johannes Kaiser's ideology be considered as inspired or close to Nazism? Answer in Spanish.

4: Qué dice Johannes Kaiser con respecto a los derechos y deberes de las mujeres?

5: Considering the following analysis (Tab 4) of Johannes Kaiser's opinions related to topics linked to women in general, would you say that he would represent a risk for the defense and promotion of women's rights?

6: Basado en el análisis anterior, podría Johannes Kaiser ser considerado misógino, o en general de estar en contra de las mujeres y sus derechos?

Las respuestas de NLM y Gemini las puse en un Google doc (una por tab).

También creé un Audio Overview en NotebookLM, tanto en español (corta, limitación de NLM) como en inglés (más larga, super buena :) ).

Todo está en esta carpeta: [https://drive.google.com/drive/folders/1EungzG06qfBiuvFHfDbfbTklGnFBL8Fz](https://drive.google.com/drive/folders/1EungzG06qfBiuvFHfDbfbTklGnFBL8Fz)

Si quieren que siga el análisis, pongan sus prompts más abajo y yo responderé con la respuesta de NLM o Gemini, o ambos, dependiendo de la pregunta.

**Resumen/TL;DR del análisis:**

**¿Quién es Johannes Kaiser? Un vistazo rápido a sus principios clave:**

Johannes Kaiser se identifica como **nacional libertario**, una corriente que busca un **Estado mínimo y limitado**. Sus ideas se centran en la protección de las **libertades individuales** como la vida, la dignidad y la propiedad privada, las cuales considera derechos inalienables y superiores al Estado.

En lo **político**, aboga por un **imperio de la ley y el orden**, proponiendo la despolitización del poder judicial y el combate frontal a la corrupción y la criminalidad mediante el cumplimiento estricto de la ley y el control de fronteras. Critica la ""izquierda refundacional"" y el Partido Comunista, a los que ve como antidemocráticos.

**Económicamente**, es un firme defensor del **libre mercado**. Propone una **drástica reducción del gasto público** y del tamaño del Estado, con recortes de funcionarios y auditorías forenses para identificar ineficiencias. Aboga por una **baja generalizada de impuestos** y la eliminación de contribuciones, sugiriendo un ""flat tax"" del 15%. Defiende la **propiedad privada de los fondos de pensiones** y se opone a los sistemas de reparto.

**Filosóficamente**, su visión se ancla en la idea de que el **ser humano es de creación divina** y detenta derechos que el Estado debe respetar. Valora la **libertad de expresión y culto** y defiende el derecho preferente de los padres a educar a sus hijos según sus valores. Es un crítico de la ""ideología de género"", enfatizando las **categorías biológicas de hombre y mujer** para la formulación de políticas públicas.

En resumen, Kaiser busca un **cambio radical en el rol del Estado chileno**, reduciendo su intervención para liberar las fuerzas individuales y de mercado, todo ello bajo una sólida estructura moral y el imperio de la ley^(.)",https://reddit.com/r/RepublicadeChile/comments/1lruo46/un_análisis_de_entrevistas_de_johannes_kaiser/
1lrsigv,Votantes de Kaiser ¿Quiero saber por qué votarán por Kaiser?,105,jpjoestar,287,2025-07-04 21:25:29,"Esto no es un ataque ni nada, genuinamente tengo la intriga de saber por qué van a votar por el. Claramente el candidato más polémico de la derecha actualmente ¿que planes tiene para su gobierno o es solamente por el discurso contra la izquierda que maneja? 

PD: quería publicarlo en el otro subreddit pero me da miedo el ban xd",https://reddit.com/r/RepublicadeChile/comments/1lrsigv/votantes_de_kaiser_quiero_saber_por_qué_votarán/
1lrrr4a,"Johannes Kaiser apoyaría ""sin duda"" un golpe de Estado si se dieran mismas circunstancias que en el 73",13,MELERIX,26,2025-07-04 20:51:14,"**Johannes Kaiser**, candidato presidencial del Partido Nacional Libertario (PNL), se refirió al impacto de **Jeannette Jara** tras su contundente victoria en las primarias. En entrevista con Tomás Mosciatti en “De Frente”, Kaiser afirmó que “**no creo que -Jara- llegue a la presidencia, pero puede hacer mucho daño siendo quien conduzca la oposición**“. Asimismo, dijo que “sin duda” apoyaría un golpe de Estado si se dieran las circunstancias similares a 1973.-

El candidato explicitó su temor ante un eventual gobierno del Partido Comunista. “La verdad sería probablemente el fin de la democracia en Chile”, dijo. Asimismo, atribuyó el triunfo de la candidata del PC al apoyo de la derecha, “Jeannette Jara recibió el respaldo de Chile Vamos para llegar a esta posición”, sostuvo.

Respecto a los resultados, Kaiser admitió que “no habría esperado que fuese así, con tanta diferencia”. Además, reiteró su escepticismo sobre sus opciones en las elecciones generales. “No, no creo”, enfatizó al ser consultado sobre sus posibilidades de victoria.",https://reddit.com/r/RepublicadeChile/comments/1lrrr4a/johannes_kaiser_apoyaría_sin_duda_un_golpe_de/
1lrib66,Hay alguna explicacion racionale para la increible inoperancia de la derecha,0,elmisteriosoviaje,47,2025-07-04 14:07:05,"Viendo la escena politica en el ultimo tiempo, es posible descifrar como la derecha puede hacerlo tan mal?, considerando:

-La pesima campaña de kast en segunda vuelta en la pasada eleccion

-Perder la posibilidad de una consolidacion de la constitucion del 80, proponiendo algo q si tomara algo de las demandas existentes en vez de meter sus antojos (IMO ahi la derecha lo perdio todo)

-Las polemicas innecesarias de matthei

-Q a pesar de ser una figura politica de 30 años de experiencia, con excelente educacion, con asesores comunicacionales y todo, se tire la misma opinion q una vieja ignorante en el año 89 en torno al golpe??, ninguna reflexion mas profunda??? 

-La estupidez del casi tongo de primarias q matthei queria a armar

-Q se levante a kaiser, un equivalente a boric, por lo inoperante y sin curriculum, como candidatura seria

-Q se tome en serio como intelectual al hermano de kaiser, q siendo generoso se le puede considerar mediocre, q plagia el tema central de su ultimo libro

-Los 11 (?) Voceros de matthei, en q planeta a alguien se le ocurre q es buena idea

-tantas mas

Parece q lo unico inteligente del sector es el silencio de kast ante casi todos los ultimos eventos, lo q es bien triste

Ahora estoy viendo q 99% de personeros d derecha van a darle majaderamente con el anticomunismo, adormeciendo la oreja del votante medio, anulando el mensaje y sin poder dejar en claro pq un gobierno pc es un peligro tan grande 

Mas encima, la izquierda puede q llegue a lista unica parlamentaria, seria la derrota total de la derecha, y el fin de la constitucion de los 80, con la reforma de quorum simple para modificarla q hicieron hace un tiempo

No se si en otros paises q llego un populista de izquierda al poder paso esto mismo: q la derecha por su estupidez es factor importante en su triunfo 

Todo esto veo q esta dando una posibilidad real de tener un gobierno comunista, en el q los proximos 20 años vamos a estar en la basura de la basura como pais, todo por tener gente tan weona en posiciones de poder en la derecha

Como se entiende tanta estupidez?",https://reddit.com/r/RepublicadeChile/comments/1lrib66/hay_alguna_explicacion_racionale_para_la/
1lrhxwt,¿Vieron la entrevista de anoche de Tomás Moschiatti a Kaiser?,126,anxious-wreck,244,2025-07-04 13:49:14,"Me pareció impresionante la soltura con la que dice que apoyaría si tuviera que hacerse una nueva dictadura o 'pronunciamiento' como le dicen algunos, justificando todo lo que involucró, y cuando Moschiatti le preguntó por las muertes, detenciones, desapariciones y torturas, Kaiser se dio piruetas olímpicas para defenderlo.

¿Vieron la entrevista? ¿Qué opinaron?

(Sí, queridos mods, este post es de las elecciones, pero no lo quiero comentar en la discusión random mensual).

EDIT: menos mal el ozz me tiene bloqueado porque me basta con el pepino en los comentarios",https://reddit.com/r/RepublicadeChile/comments/1lrhxwt/vieron_la_entrevista_de_anoche_de_tomás/
1lr4jqb,Jara casi duplica al 2do + 3er lugar,136,Maztinyer,141,2025-07-04 00:51:27,,https://reddit.com/r/RepublicadeChile/comments/1lr4jqb/jara_casi_duplica_al_2do_3er_lugar/
1lp8fkn,Ahora que la derecha tiene asegurada la eleccion presidencial,2,ozzraven,48,2025-07-01 18:51:57,"¿Como evitaran farrearse esta oportunidad? Porque el unico peligro que veo, es que pase kaiser a segunda vuelta o que a Matthei le den mas Bidenazos.

¿Como van a contrarrestar la propaganda mula xenofoba que les invita a votar por jara?",https://reddit.com/r/RepublicadeChile/comments/1lp8fkn/ahora_que_la_derecha_tiene_asegurada_la_eleccion/
1lo9e2a,(Que no se olvide) Los estrechos lazos entre las FARC y el PC chileno que fueron plasmados en casi 300 correos,93,Ok-Interest-7641,40,2025-06-30 15:46:02,"Ustedes creen que Jara es centrada? que es piolita? Es el lobo disfrazado de oveja, capaz de desconocer su convicciones para luego imponer su secta comunista extrema. 

Todos los flojos que no fueron a votar se van a pegar en la cabeza en las presidenciales, Jara o la extrema derecha (Republicanos, UDI, y el partido penca de Kaiser)  Me rio todo el rato. ",https://reddit.com/r/RepublicadeChile/comments/1lo9e2a/que_no_se_olvide_los_estrechos_lazos_entre_las/
1lo8sbg,Qué opinan de esta analogía?,0,Glad-Philosopher8261,14,2025-06-30 15:21:21,Kaiser es Milei. Kast es Bullrich. Matthei es Larreta y así?,https://reddit.com/r/RepublicadeChile/comments/1lo8sbg/qué_opinan_de_esta_analogía/
1lntcar,Cadem semana pasada (segunda vuelta Kast vs Jara),19,SituationNew7609,26,2025-06-30 00:54:46,"Jara le ganaría solo a Kaiser, hasta Parisi le ganaría a Jara.",https://reddit.com/r/RepublicadeChile/comments/1lntcar/cadem_semana_pasada_segunda_vuelta_kast_vs_jara/
1lnt2xd,La Cadem de la semana pasada.,10,SituationNew7609,6,2025-06-30 00:42:03,"Hicieron unos escenarios horribles de segunda vuelta, no tomaron Kast vs Jara aparentemente, porque su página está caída.",https://reddit.com/r/RepublicadeChile/comments/1lnt2xd/la_cadem_de_la_semana_pasada/
1li5xrg,"Al final Kaiser si hizo ver a Kast como moderado, y 67% afirman que jamás votarían por Jara.",71,SituationNew7609,115,2025-06-23 04:00:15,,https://reddit.com/r/RepublicadeChile/comments/1li5xrg/al_final_kaiser_si_hizo_ver_a_kast_como_moderado/
