id,title,score,author,num_comments,created,selftext,permalink
1mhflmr,"Se repetirá lo de la elección pasada, donde Parisi le quita votos a la izquierda, pero en 2da vuelta se le vayan a la izquierda nuevamente?",1,Maztinyer,30,2025-08-04 15:52:59,,https://reddit.com/r/RepublicadeChile/comments/1mhflmr/se_repetirá_lo_de_la_elección_pasada_donde_parisi/
1mg5yr7,La unión DC-Jara terminó perjudicando a Jara? La campaña sucia de desprestigio a Kast la terminó undiendo? El que no habla concede. Es esa la lectura?,3,Mula_4life,14,2025-08-03 01:43:19,"Es mejor no decir nada y ""hacerse el weon"" termina dandote más votos con la derecha (excepto Matthei)? Es esa la lectura política de esta jornada?",https://reddit.com/r/RepublicadeChile/comments/1mg5yr7/la_unión_dcjara_terminó_perjudicando_a_jara_la/
1mg32fz,"Encuesta Atlas Intel, Jara solo le ganaría a Kaiser en segunda vuelta.",18,SituationNew7609,57,2025-08-02 23:24:42,,https://reddit.com/r/RepublicadeChile/comments/1mg32fz/encuesta_atlas_intel_jara_solo_le_ganaría_a/
1mfr4wx,"Encuesta Panel Ciudadano UDD, La derecha gana en todos los escenarios medidos en segunda vuelta, Kast gana la primera vuelta.",54,SituationNew7609,54,2025-08-02 14:55:08,[https://panelciudadano.cl/wp-content/uploads/2025/08/Presidencial-1-ago-El-Mercurio.pdf](https://panelciudadano.cl/wp-content/uploads/2025/08/Presidencial-1-ago-El-Mercurio.pdf),https://reddit.com/r/RepublicadeChile/comments/1mfr4wx/encuesta_panel_ciudadano_udd_la_derecha_gana_en/
1mez409,Parisi sube como la espuma,0,Green-Cucumber-2232,38,2025-08-01 16:12:57,,https://reddit.com/r/RepublicadeChile/comments/1mez409/parisi_sube_como_la_espuma/
1mbl8v9,"La belleza de los sueños, la dureza de la verdad y el deber de mirar hacia adelante",0,Only-Training-967,7,2025-07-28 17:41:31,"Hay algo profundamente inspirador en la juventud que cree. Que cree en la justicia, en la igualdad, en el poder de cambiar el mundo con ideas. Esa juventud que sale a marchar, que pinta pancartas, que debate con pasión en las aulas y en las plazas, convencida de que la historia aún puede escribirse de otra forma.

Esa juventud fue protagonista en 2021. Votó por un cambio. Por una generación distinta, que decía venir sin mochilas, sin amarras, sin favores. Un nuevo trato. Ética, transparencia, justicia social.

Y sin embargo, a poco andar, esa narrativa idealista chocó con la cruda realidad. El Caso Convenios, con más de $90 mil millones entregados a fundaciones sin experiencia, sin control y sin resultados, desnudó lo que muchos no querían ver: que el poder corrompe incluso a quienes venían a ""limpiar"" la política. Que la nueva generación también cayó. Que no eran distintos.

Fundaciones como Democracia Viva, Urbanismo Social, ProCultura, En Ti, y muchas otras se convirtieron en sinónimos de aprovechamiento. De redes de poder paralelas, de contratos sin respaldo, de gastos personales disfrazados de vocación social. Y los mismos que criticaban a los ""de siempre"", demostraron que los vicios no eran patrimonio exclusivo de una generación.

Pero la hipocresía no terminó ahí. El Partido Comunista, emblema de la lucha social, fue denunciado por no pagar cotizaciones a sus propios trabajadores, mantener deudas por contribuciones de propiedades millonarias, y hasta por su conexión ideológica y documental con las FARC. El reciente sobreseimiento de quienes entregaron certificados falsos para exonerados politicos, generando miles de pensiones irregulares, en una auditoria realizada, podria alcanzar sobre un 40% de los casos, refleja un patrón sistemático: el uso del aparato estatal y el dolor histórico como herramientas de captura ideológica y, por qué no decirlo, de financiamiento.

Mientras el discurso habla de justicia, la práctica muestra otra cosa. Una elite que manipula el eterno conflicto de clases desde el palco de la comodidad, que vive en barrios acomodados, accede a privilegios y, al mismo tiempo, se presenta como “la voz del pueblo”.

En medio de todo esto, Johannes Kaiser se planta con honestidad. Incómodo, directo, a veces descuadrado, sí. Pero coherente. No endulza sus palabras para agradar. No se acomoda al clima ideológico de lo políticamente correcto. Y por eso lo atacan.

Se le ha acusado de misoginia, por ironizar sobre cómo muchas mujeres votan por ideas que afectan sus propios intereses. De gordofobia, por decir que Jeanette Jara parecía Bachelet con esteroides, cuando la crítica era política, no física. Se le ha llamado antiinmigración, cuando su preocupación ha sido siempre la seguridad, el gasto público y la integración real. Su humor, nacido de un podcast, ha sido cortado y manipulado. Pero su idea es clara: Chile necesita reglas claras, trato parejo y honestidad intelectual.

Kaiser también ha sido uno de los pocos que se atreve a decir que si se va a hablar del golpe, hay que hablar completo. Que no basta con condenar a los militares y olvidar que fueron partidos democráticos, como la DC con firmas de líderes como Patricio Aylwin y Eduardo Frei –quienes justificaron públicamente el golpe, los que pidieron su intervención. Que si se avala un golpe de Estado, se debe asumir también la responsabilidad moral por sus consecuencias. Que no se puede conducir mirando solo el retrovisor.

Él no defiende la tortura ni el autoritarismo, pero tampoco acepta que se oculte la historia para comodidad de una narrativa. Y propone que si queremos tener FF.AA. comprometidas con el orden y la democracia, también debemos tratarlas con justicia. Por eso sugiere liberar a los presos de Punta Peuco en régimen domiciliario: por humanidad, por edad, por falencias en los juicios. Porque un país que quiere protegerse necesita instituciones que confíen en su Estado.

No es impunidad, es coherencia. No sigamos premiando a quienes se enquistaron en el sistema, vaciaron el sentido del sueño, y drenaron las aspiraciones de un pueblo entero con ideologías que solo funcionan en el papel. Chile fue un faro en América Latina. Hoy tambalea entre el resentimiento y la propaganda.

¿Queremos cambiar eso? Entonces basta de relatos vacíos. Hablemos con honestidad y porque no dejemos de conducir mirando el retrovisor. Es hora de mirar hacia adelante.",https://reddit.com/r/RepublicadeChile/comments/1mbl8v9/la_belleza_de_los_sueños_la_dureza_de_la_verdad_y/
1mb92c9,Algún presente que apoye a Kaiser?,17,Izzy_Lindemann,216,2025-07-28 07:43:08,"Y que me pueda argumentar el porqué por favor... realmente quisiera escuchar sus razones, esto no es con el ánimo de ofender a nadie.",https://reddit.com/r/RepublicadeChile/comments/1mb92c9/algún_presente_que_apoye_a_kaiser/
1manrst,Que opinan de esta camapaña anti servel,199,Chastrexx1,326,2025-07-27 15:32:10,"Cache que ahora la derecha esta intentando meter la idea de que el servel esta manejado por comunistas y los estan persiguiendo por que vieron admisible disolver el partido de kaiser por golpista, y despues se tiran esos comemtariso, quenopinan de esta gente?? Esta de mas decir que hay muchas cuentas que son bots  o trolls pero hacen la funcion de propagar eda idea, seguramente con un sueldo por hacer eso",https://reddit.com/r/RepublicadeChile/comments/1manrst/que_opinan_de_esta_camapaña_anti_servel/
1m9h6qi,lo ultimo de axel kaiser,118,Straight_Food_5516,138,2025-07-26 02:46:33,"q opinan de lo ultimo q se mando axel kaiser pidiendo a tiroteolandia q presione al servel para evitar q el partido de su hermano sea proscrito?

esa wea pa mi es traicion a la patria eso y jara podria aprovecharlo perfectamente pa cagarse a kaiser y kast",https://reddit.com/r/RepublicadeChile/comments/1m9h6qi/lo_ultimo_de_axel_kaiser/
1m899f8,Cosas que no entiendo al respecto de la tabla de posiciones de meganoticias,251,opinologopinologo,139,2025-07-24 17:36:10,"¿Por qué todos menos Jara estan en azul? Si me dicen que es porque es de izquierda, Parisi dice no ser ni de derecha ni de izquierda y esta azúl.
¿Por qué Parisi esta primero y no Kast con Jara?
¿Por qué a la derecha de Jara sale PC de su partido, pero de Matthei sale CHV de la coalición, si Jara representa a toda la izquierda?",https://reddit.com/r/RepublicadeChile/comments/1m899f8/cosas_que_no_entiendo_al_respecto_de_la_tabla_de/
1m4fyum,"El prontuario de Johannes Kaiser: Fondos fiscales malgastados, misoginia, negacionismo y golpismo",0,Maztinyer,7,2025-07-20 05:28:03,,https://reddit.com/r/RepublicadeChile/comments/1m4fyum/el_prontuario_de_johannes_kaiser_fondos_fiscales/
1m3itmg,Tengo esta wea en la cabeza de ahce unos díasy simplemente quiero escribirla,20,Sebadiaz,30,2025-07-19 01:40:10,"Y si, lo de que kaiser sea un degenerado politico, y a la matthei la estén dejando de vieja con alzheimer, sea en efecto una forma de hacerle campaña a kast??, mas que nada lo pienso pq de la nada la derecha empezó a atacarse entre si y de una forma descaradisima, pero a kast no le han sacado ninguna cosaa, eso teniaa LSHW ",https://reddit.com/r/RepublicadeChile/comments/1m3itmg/tengo_esta_wea_en_la_cabeza_de_ahce_unos_díasy/
1m2bsbt,"""¡No sea mentiroso!"": la desaforada reacción de Kaiser a pregunta de Iván Núñez en medio de entrevista",20,SrHuev0n,42,2025-07-17 17:14:24,"La primera vez que leí del plebiscito de Allende fue en un libro de Pinochet que me prestó un compañero pinochetista del colegio. Era un libro entrevista y el general se cagaba de la risa que se adelantó a la jugada.


Me parece interesante que el guatón esté jugando a la posverdad, cuando era más fácil tomar el camino del p8nochetismo previo, decir que se adelantaron.


Para más información sobre el plebiscito de Allende:


[El plebiscito
la última hoguera en La Tercee](https://especiales.latercera.com/22-dias-que-sacudieron-a-chile/el-plebiscito-la-ultima-hoguera/)


[Inédito audio revela que Allende iba a convocar plebiscito el 11 de septiembre de 1973 en El Mostrador](https://www.elmostrador.cl/noticias/pais/2023/08/24/inedito-audio-revela-que-allende-iba-a-convocar-plebiscito-el-11-de-septiembre-de-1973/)",https://reddit.com/r/RepublicadeChile/comments/1m2bsbt/no_sea_mentiroso_la_desaforada_reacción_de_kaiser/
1m1yvfl,Elección presidencial de Chile (resultado final en primera y segunda vuelta si la hubiera) en las apuestas de Polymarket.,50,SituationNew7609,43,2025-07-17 06:07:15,"Los mercados son más predictivos que las encuestas para saber los resultados, aunque faltando tanto no sirve de nada, hay mucha evidencia que demuestra que los mercados de apuestas predicen mucho mejor al ganador final.",https://reddit.com/r/RepublicadeChile/comments/1m1yvfl/elección_presidencial_de_chile_resultado_final_en/
1m0khqv,¿La absurda liberación del Sicario le dará más puntos a Kast-Kaiser?,56,Deepinsight__,77,2025-07-15 16:16:35,"La absurda liberación de un asesino a sueldo perteneciente al tren de Aragua tendrá enormes repercusiones en nuestro sistema,esto recién comienza.

¿Creen que una de esas consecuencias sea una subida dramatica en las encuestas de estos candidatos?",https://reddit.com/r/RepublicadeChile/comments/1m0khqv/la_absurda_liberación_del_sicario_le_dará_más/
1m0aw3u,Sobre incentivar cambio político,2,Traditional_Ball1392,5,2025-07-15 07:56:06,"Esta reflexión tiene dos secciones, un análisis con respecto al populismo y el rol que debería cumplir la izquierda chilena, y después cómo lo aplico al escenario político actual.

***1 Incentivando Cambio Político***

Yo no soy bajo ninguna circunstancia comunista o socialista, pero entiendo que el capitalismo actual conlleva problemas sistémicos necesarios de resolver para el bien común en donde ramas socialistas, de libre mercado, entre otras, deben unirse para hacer al mercado lo más eficiente posible para el bien social. Para que esto se lleve a cabo se deben de dar dos cosas: un incentivo social privado, y uno público. Los actores en el fin privado vendrían siendo los actores del flujo circular del mercado, y en el caso público es el rol del Estado en dicha transacción. Para fines prácticos, consideraré la derecha los defensores conservadores de ideales y narrativas sociales puestas (status-quo ideológico) y la izquierda como lo contrario (el anti-status-quo ideológico). Actualmente estamos viendo una lamentable y abismal ola populista de los movimientos de ultra-derecha que trae más y más gente a resentimientos artificiales para ganar el juego del poder. Yo no soy un emotivista, pero si hay algo que podemos aprender de ellos es una cosa la cual la incorporaré después al argumento en cuál es el rol de la izquierda para no solo balancear el tablero político, sino volver a la razón como motivo político.

El emotivismo indica que las proposiciones morales no son más que expresiones de emoción. Decir “el asesinato está mal” es igual a decir “boo asesinar”, no es “a mí no me gusta el asesinato” ya que este es verificable (verdadero o falso), sino es la expresión de tu intuición y sentimiento en sí. Esto nos lleva a deducir que las narrativas y reglas sociales no son más que la expresión de un sentimiento colectivo con respecto a una forma de actuar. Asimismo, las leyes son la institucionalización de dicho sentimiento colectivo. Lo peligroso de esto es que abre la puerta a los movimientos populistas radicales los cuales dejan de buscar representar el sentimiento colectivo racional, sino que ocupan un discurso que instala una narrativa detrimental para la sociedad, generalmente antagonizante. Como dijo Zizek, “para el populista el problema no es \[el sistema\], sino el actor … el banquero, no el capitalismo; el inmigrante, no la guerra”. Este actor es lamentablemente la víctima del sistema, movido por incentivos instalados sistemáticamente en vez de individuales, genuinos y originales. El populista justamente instala la narrativa de “nosotros contra ellos”, donde el “pueblo” (generalmente la mayoría popular nacional) tiene que pelear contra un grupo pequeño que en teoría es un peligro para ellos. Esto es absolutamente fundamental para todo populista. El mejor ejemplo es Hitler con el Dolchstoßlegende donde instala la antagonización del pueblo judío, la actual narrativa anti-terrorista israelí que antagoniza al pueblo árabe, el “build the wall” de Trump que antagoniza a los inmigrantes mexicanos (entre todas las que tiene contra los árabes, terroristas, franceses, etc.), y la narrativa general republicana actualmente en Chile anti-haitiano, venezolano, colombiano, entre otras nacionalidades. Lo que diferencia al populista del activista anti-status-quo es el incentivo: el populista instala el conflicto, el activista lo reconoce. Resolver un problema artificial es muy fácil, es semántico y retórico; resolver un problema real es más complejo ya que se cuestiona el mismo fundamento sistémico que procura resolver, este el cual la derecha tan bien defiende. Así, el rol de la izquierda en su antagonización retórica no puede ser artificial, sino pragmático y material.

El sentimiento colectivo dejó de ser constituido por incentivos racionales y comenzó a ser semántico, por lo que lamentablemente la izquierda debe de comenzar a jugar en el tablero: dejar el mundo moralista, dejar el mundo intelectual, dejar la estrategia intelectualmente jerárquica. Esto sólo lo puedo mejor representar con otra analogía, esta vez original. Imagínate tienes un árbol de papaya, y te crece una papaya. Esta la ves y sabes, casi por intuición, que es la más jugosa, dulce, de textura fina, y simplemente la mejor papaya del mundo. Tienes en tus manos la papaya. ¿Cuál es el problema? Hay gente que simplemente no le gusta la papaya. La papaya puede ser muchas cosas: la retórica izquierdista, su reputación, o simplemente las ideas. El problema no es trabajar en la papaya, sino construir su gusto.

Fue suficiente de la papaya. *El rol actual de la izquierda es dejar de purificar el agua y comenzar a construir la sed.* Chile (y me atrevo a generalizar, el mundo) lo que menos necesita es más populismo, necesita un movimiento popular racionalista que reconstruya la narrativa democrática (que el sentimiento colectivo sea pro-progreso económico, social y medioambiental) y unificado en la constante evolución ideológica y sistemática.

***2 Lo que podemos sacar de esto***

Boric era y es un gobernante inepto e incapaz, pero supo unificar la retórica poblacional del estallido social en un movimiento político representante. Se debe dejar de antagonizar a actores específicos y reconocer las fallas naturales en el sistema y trabajar en conjunto para resolverlas. Por estas razones es tan importante que Kast no gane porque instala el conservadurismo como narrativa gubernamental; tampoco podemos dejar que Jara gane porque busca reconstruir y desmenuzar el sistema en vez de resolverlo; tampoco podemos dejar que Kaiser gane porque desincorpora el rol del Estado en su radical neoliberalismo. Aunque duela al alma dejar a una votante del “Sí” de Pinochet, es la mejor opción. No necesariamente por un conflicto o convergencia ideológica, sino porque Kast, Kaiser y Jara están fundamentalmente impulsados por un discurso y una estrategia populista (Jara antagonizando a la ultraderecha, Kaiser y Kast criticando a Matthei hasta por las patas, y Kast funcionando como un falso moderado). Entre más de centro sea el siguiente presidente, mejor, porque este cumplirá el rol de reincorporación ideológica para el bien común en vez de continuar con la antagonización de coaliciones políticas. No soy de derecha o izquierda, soy agnóstico a las etiquetas políticas justamente porque se han instalado también como estrategia antagonizadora; esto no es más que una opinión política y estoy abierto a cualquier crítica (siempre y cuando sea con respecto a la idea, no a mi persona).",https://reddit.com/r/RepublicadeChile/comments/1m0aw3u/sobre_incentivar_cambio_político/
1lzoyvj,Ministra Orellana acusa estrategia política en campañas de Kast y Kaiser: “Uno dice barbaridades para que el otro parezca moderado”,8,Maztinyer,27,2025-07-14 16:10:47,,https://reddit.com/r/RepublicadeChile/comments/1lzoyvj/ministra_orellana_acusa_estrategia_política_en/
1lznxag,El culto a Jeannette Jara me llega a dar un poco de miedo,289,amazing-apple-117,572,2025-07-14 15:30:38,"Cuando encuentro comentario en RRSS apoyando a Kaiser en general son weas de muy poco esfuerzo, tipo ""Excelente Johannes poniendo zurdos en su lugar, Kaiser 2026"". Pero con Jara en twitter, reddit, y todos lados encuentras papiros larguísimos sobre lo gloriosa que es, que viene de abajo, que tiene un carisma único que todos le envidian, que ha logrado tanto como ministra, etc. Con Kaiser y Kast la gente parece que les resuena la idea de tener un facho que diga opiniones fachas sin miedo, pero rara vez los endiosan a ellos particularmente. Con Jara (y muchos otros rostros de la izquierda) la endiosan a ella, su historia, su carrera, su figura.

Les seré bien honesta, en la derecha chilena hay gente muy pero muy weona. Pero algo que me agrada es que la derecha chilena no parece tan propensa a caer en cultos a la personalidad tipo Trump. Hasta los abiertos pinochetistas que encuentras hoy te van a reconocer, aunque sea por conveniencia y evitar drama, que hubo cosas que se hicieron mal o que no deberían haber hecho (esto incluye a todos los candidatos de la derecha). Pueden dejar a Pinochet ""mal parado"" para quedar mejor parados ellos. Pero con la izquierda, con la NC, con el FA, ahora con Jara, veo mucho esa necesidad de no solo defender, pero negarse rotundamente a conceder cualquier punto, alegando que cualquier mala impresión que uno pueda tener de ellos es pura manipulación de los medios de derecha.

Yo no sé (ni creo) si con Jara vayamos a tener una dictadura comunista o lo que sea. Pero lo que sí estoy segurísima, es que podríamos tener cuentas de luz de 120 lucas y desabastecimiento en la mitad de los supermercados del país, y las RRSS van a estar más repletas que nunca de gente diciéndote que todo está la raja y que no hay que creerle a la tele (ni a tus ojos, ni a tus amigos, ni tus propias experiencias). Con un gobierno de derecha eso jamás pasaría porque, además de que la izquierda anda más detonada para marchar, la gente de derecha es menos orgullosa y fanática, y como se vio con Piñera - si el candidato por el que votaron las está cagando, no tienen problema en mandarlo a la chucha. Con Jara el país puede estar peor que nunca, pero siempre habrá un % no menor de gente haciendo lo imposible por convencernos de lo contrario (y esa es la gente que organizaría todas las marchas si fuera gobierno de derecha).",https://reddit.com/r/RepublicadeChile/comments/1lznxag/el_culto_a_jeannette_jara_me_llega_a_dar_un_poco/
1lyx4l5,"Insulto a Jara, aplausos a Crespo y cánticos al dictador Pinochet: La polémica proclamación de Kaiser",14,Maztinyer,39,2025-07-13 17:31:57,,https://reddit.com/r/RepublicadeChile/comments/1lyx4l5/insulto_a_jara_aplausos_a_crespo_y_cánticos_al/
1lwxptm,Ante dichos sobre golpe de Estado: Jara acusa a Kaiser de “táctica” para que Kast parezca como “alguien más moderado” - La Tercera,17,Maztinyer,25,2025-07-11 05:28:35,,https://reddit.com/r/RepublicadeChile/comments/1lwxptm/ante_dichos_sobre_golpe_de_estado_jara_acusa_a/
1lv4hef,"Curiosidad, siempre que Axel Kaiser publica algo hay como 180 bots que publican lo mismo a los segundos",0,opinologopinologo,18,2025-07-09 01:03:26,"La imagen que se posteo 184 veces, la posteo Axel Kaiser en Twitter (ahora X) primero.",https://reddit.com/r/RepublicadeChile/comments/1lv4hef/curiosidad_siempre_que_axel_kaiser_publica_algo/
