id,title,score,author,num_comments,created,selftext,permalink
1mht3ik,¿Porqué Matthei se hunde en las encuestas?,2,AwareGuy64,1,2025-08-05 00:19:31,"La iñora hace unos meses iba primero, ahora va cuarta. ¿Alguien por aquí pensaba votar por ella y cambió de opinión?

Yo voto por ella porque me rehuso a votar por el partido comunista, y por otro lado Kast me parece demasiado conservador en temas valóricos y ademas medio chanta (muy amigo de las fake news)

",https://reddit.com/r/RepublicadeChile/comments/1mht3ik/porqué_matthei_se_hunde_en_las_encuestas/
1mhlsz1,"Parisi pasa a tercer lugar en Polymarket, Aunque el líder absoluto que sube y sube es Kast.",26,SituationNew7609,13,2025-08-04 19:38:37,"La apuesta es sobre quién será electo en primer o en segunda vuelta, esos no tiene importancia para los fines de la apuesta, aunque aún tiene muy poco volumen.",https://reddit.com/r/RepublicadeChile/comments/1mhlsz1/parisi_pasa_a_tercer_lugar_en_polymarket_aunque/
1mhflmr,"Se repetirá lo de la elección pasada, donde Parisi le quita votos a la izquierda, pero en 2da vuelta se le vayan a la izquierda nuevamente?",2,Maztinyer,30,2025-08-04 15:52:59,,https://reddit.com/r/RepublicadeChile/comments/1mhflmr/se_repetirá_lo_de_la_elección_pasada_donde_parisi/
1mhfjh2,Por qué Parisi?,0,FairManufacturer2507,30,2025-08-04 15:50:44,"Hoy leía que tiene 10% en cadem, más que matthei incluso. Por qué es buen candidato para el 10% de los chilenos? Qué aporta?

",https://reddit.com/r/RepublicadeChile/comments/1mhfjh2/por_qué_parisi/
1mguxzu,"Ya era Jara, más de la mitad de la gente dice que nunca votaría por ella... (criteria agosto)",94,SituationNew7609,108,2025-08-03 22:20:38,"Solo puede ganar Kast o Matthei, y todo parece que ganará Kast.",https://reddit.com/r/RepublicadeChile/comments/1mguxzu/ya_era_jara_más_de_la_mitad_de_la_gente_dice_que/
1mgsfg0,Mejor candidato según ChatGPT,0,Vizcacha_nortina,10,2025-08-03 20:41:31,"Le hice esta pregunta a ChatGPT:

""Chile actualmente pasa por una crisis de seguridad causada por el crimen organizado, el comercio informal, la inmigración irregular, entre otros. Además, estamos con el empleo y la productividad estancadas. Hay crecimiento económico, pero lento, teniéndose una fuerte dependencia del cobre. Por último, hay una crisis en la educación y salud públicas, mostrando esta última largas listas de espera. En este contexto, los candidatos José Antonio Kast, Evelyn Matthei y Jeannette Jara ofrecen distintas perspectivas. Considerando los problemas que te enumeré, ¿Cuál de los tres candidatos ofrece propuestas más factibles de realizar, para devolver la estabilidad al país en el corto y largo plazo?""

No pegaré la respuesta que me dio, o el post quedaría enterno. Esta fue su recomendación final después que le pedí que hiciera una investigación profunda:

""En conjunto, Evelyn Matthei ofrece el perfil más realista y equilibrado dada la coyuntura. Combina medidas de seguridad reforzada (muro fronterizo tecnológico, expulsiones selectivas) con políticas económicas moderadas enfocadas en formalizar empleo y aumentar productividad (formación técnica, ampliación de salas cuna). A diferencia de Kast, no propone cambios dramáticos (p.ej. militarizar masivamente ni leyes revolucionarias), y a diferencia de Jara su agenda económica no descuida la contención fiscal ni asume riesgos elevados de empleo. Si bien ninguna propuesta asegura resolver todos los problemas de corto plazo, el plan de Matthei es cuantitativamente más factible: no choca frontalmente con instituciones (como lo harían las ideas de mano dura de Kast) ni exige saltos fiscales insostenibles (como muchas de Jara). Por ello, en nuestra opinión Matthei brinda mejores oportunidades de estabilidad para Chile –tomando las medidas de orden público necesarias sin desatender la recuperación económica y social.""

¿Qué opinas?",https://reddit.com/r/RepublicadeChile/comments/1mgsfg0/mejor_candidato_según_chatgpt/
1mgrhp3,Desempeño Ministras del Trabajo,18,Antiaweonaos,60,2025-08-03 20:03:58,"Hola!

Quiero someter esto a prueba. Me gusta desmentir y contrastar data, por lo que me di la paja de bajar los datos de desempleo del INE, y en resumidas cuentas, efectivamente Jara genero más empleo que Matthei (compare el año anterior de cada Ministra vs el número al final de su periodo), y el **aumento de desempleo** se debe al aumento explosivo de la fuerza de trabajo (tengo entendido que es por la inmigración).

Me gustaría saber si el cálculo es correcto o si cometí un error para tener la info correcta.

Se que es pedir mucho en reddit, pero sean serios si van a desmentir o argumentar.

[Captura del excel del INE](https://preview.redd.it/epxigdkkqugf1.png?width=893&format=png&auto=webp&s=e2420013b8383e9c6d6cda7ff91b54ae79e48dd5)

Acá está el link directo del INE con los datos

[https://www.ine.gob.cl/docs/default-source/ocupacion-y-desocupacion/cuadros-estadisticos/estimaciones-anuales/indicadores\_principales\_anual.xlsx?sfvrsn=3f187a7b\_8](https://www.ine.gob.cl/docs/default-source/ocupacion-y-desocupacion/cuadros-estadisticos/estimaciones-anuales/indicadores_principales_anual.xlsx?sfvrsn=3f187a7b_8)

EDIT: Ya van como 2 weones que dicen que no estoy tomando la tasa desempleo, siendo que está en el mismo análisis. Se las dan de vios y no tienen ni comprensión lectora básica jajajajaja.",https://reddit.com/r/RepublicadeChile/comments/1mgrhp3/desempeño_ministras_del_trabajo/
1mgj85r,"Nicolás Ibáñez: “La elección presidencial es algo secundario en este momento, lo más importante son las listas parlamentarias” - La Tercera",8,1750gt16,1,2025-08-03 14:26:40,"El martes por la mañana, el empresario Nicolás Ibáñez Scott fue hasta el Hotel W para escuchar al historiador británico y escritor Niall Ferguson en la conferencia anual de BCI. Salió con su libro “Doom: The Politics of Catastrophe”, firmado por el mismo autor.

Posterior al seminario y tras conversar por varios minutos con los asistentes, Ibáñez -que controló junto a su hermano D&S, la empresa que vendieron a Walmart, y que hoy administra sus inversiones a través de su *family offices* Drake- accedió a conversar en un café cercano, en el mismo barrio El Golf, en la comuna de Las Condes, donde se explayó sobre la situación política del país y las elecciones presidenciales.

**¿Cómo evalúa el momento político?**

Hay una escaramuza muy natural que ocurre en un periodo preeleccionario, algo que sucede en todas partes del mundo. Es la competencia por el espacio político. Así que no hay que preocuparse demasiado. Naturalmente, se va a producir un ordenamiento.

Diría que Chile está en un momento muy positivo. Desde luego hay un contrincante tremendamente valioso para todos nosotros, que es una reedición del extremismo ideológico-político. Eso es un momento político interesante, que el candidato que presenta la izquierda sea pro-Cuba, me imagino que pro-Venezuela, un resabio en parte de la Unión Soviética, un contrincante tremendamente inapropiado para la izquierda, porque se muestra con un ropaje antidemocrático. Es un buen candidato para nosotros, un mal candidato para ellos.

Claramente, la elección presidencial la va a ganar la centro-derecha. No sé si las encuestas son correctas o no, pero el próximo presidente de Chile parecería que va a ser José Antonio Kast. Pero lo importante no es eso, lo importante es el Parlamento. Diría que la elección presidencial es algo secundario en este momento, lo más importante son las listas parlamentarias. Y ahí se están dando las escaramuzas que siempre se producen, pero se van a ordenar, no me cabe la menor duda, dentro de los próximos días y semanas, porque nadie va a aceptar esto. Desde luego, no va a haber financiamiento para un circo como este.

No tiene ningún futuro un gobierno de derecha, o un gobierno más bien de una coalición, donde la llamada extrema derecha juega un rol, y los Amarillos, los democratacristianos de verdad, los concertacionistas también juegan uno. Aquí tiene que haber cabida para todo el mundo, pero con un claro liderazgo, fuerte y decisivo, donde la capacidad de ordenar al país va a ser un elemento clave.

**¿Qué espera del próximo gobierno?**

Hay dos cosas prácticas, como sabemos, el crecimiento económico/permisología y la seguridad. Son las cosas básicas que cualquier gobierno tiene que hacer bien.

Después del experimento anti-Concertación de Michelle Bachelet, que deriva en algo más extremo, que es el gobierno actual, tenemos que volver a la cordura, un país esencialmente democrático, con alternancia en el poder, con respeto por las minorías, y con un crecimiento económico en torno al 4%. Pero con un proyecto país, con una clara orientación hacia un sueño colectivo, un proyecto de identidad nacional, de aspiración compartida. No hemos escuchado nada de eso todavía.

Políticamente hay un vacío enorme, y nos ayuda inmensamente que la contraparte presente como carta al pasado. Al pasado que está absolutamente fuera de foco, como es Jeannette Jara. Por eso, yo diría que están dadas las circunstancias para que, frente al vacío y frente a las escaramuzas propias de los seres humanos, nos ordenemos y surja algo muy potente. Yo soy más bien optimista. Además, no es tan difícil, porque si no, no hay plata, nomás.

**¿No va a apoyar a ninguna campaña si la derecha no se ordena?**

Ninguna. Por supuesto. Y nadie lo va a hacer. Nadie en su sano juicio lo va a hacer. Es un mal negocio, por así decirlo. Tenemos que preocuparnos por la cosa pública, no somos meros observadores, tenemos que estar cerca de los actores políticos, especialmente la nueva generación. Especialmente los candidatos al Congreso, los candidatos a diputados y al Senado. Y que ellos sientan que hay interés, que hay preocupación, cariño y apoyo por la cosa pública de parte de gente como nosotros. Y no estoy hablando de los, comillas, empresarios. Estoy hablando del común de la gente.

**¿Es requisito necesario que haya una lista única? ¿A eso se refiere también con que se ordene la derecha?**

Yo diría que es un requisito absolutamente necesario. Circunscripción por circunscripción tiene que haber un acuerdo, eso va a generar mucho dolor, pero aquí hay que ser dictatorial, la unión es más importante, incluso que la calidad intrínseca de la persona involucrada. Y si la persona escogida no es la mejor persona, bueno, eso se arregla en el camino, pero tiene que haber una coordinación desde Amarillos hasta Republicanos.

**¿Da por ganada la elección presidencial?**

Sí, la doy por ganada. Jeannette Jara no tiene ninguna posibilidad en el Chile de hoy.

**¿El mercado está subestimando a Jara?**

Yo fui a la elección primaria, voté, no sé si debía haber votado o no, pero yo fui a votar y voté por mi candidata, Carolina Tohá. A mí me sorprendió lo que pasó, porque creo que nos merecemos tener un buen candidato por el lado de la izquierda. Un mal candidato para la izquierda es un mal candidato para Chile. Pero, coyunturalmente, es algo que nos favorece.

**¿Tiene definido su voto?**

No, eso es irrelevante. Lo que sí tengo definido es que me voy a poner muy tieso de mecha si es que no llegamos a un acuerdo en las listas parlamentarias. Evelyn Matthei no puede gobernar sin Kast, ni Kast sin Matthei, y no podemos gobernar sin la socialdemocracia tampoco; porque lo que el país demanda es un gobierno bastante autoritario, quieren ver a carabineros en la calle, quieren ver a carabineros disparando y matando a delincuentes. Políticamente, es un momento más bien de extremos, polarizado, y es la realidad del mundo.

**¿Qué nota le pone al gobierno de Boric?**

Es el gobierno que se merece Chile en este minuto. En una entrevista tomándonos un café en el barrio alto de Santiago, es fácil hablar así: yo conozco la realidad allá afuera, donde hay gente que sufre la delincuencia y la inseguridad. Pero Boric nos permitió pasar por una clase de política, de educación cívica magistral, con el intento de refundar el país, muy costosa, pero que nos ha hecho bien, porque nos recordó cómo era la bandera, a Bernardo O’Higgins y Arturo Prat. Nos recordó qué es ser chileno. Creo que es una clase de educación cívica muy costosa, pero nos ha hecho bien, y lo genial es que volvimos a la Constitución de Ricardo Lagos.

**El crecimiento per cápita está estancado hace 20 años.**

Exactamente, y eso tiene consecuencias para la gran mayoría de la gente. Eso es gravísimo y tenemos que volver a retomar un crecimiento del 4%. Los dos temas son: crecimiento y seguridad. Pero quizás, desde el punto de vista político, y ahí sí que quién es Presidente no es indiferente, habría que ver quién tiene la capacidad de articular una renovada aspiración e identidad nacional, un sueño para el país que aglutine a la gran mayoría de la gente.

**¿Cuál sería ese sueño; ser desarrollado, como era la aspiración en los años 2000?**

No diría que es sólo un tema económico, porque todo el mundo en Chile tiene aspiraciones económicas, empleo, casa, vacaciones. Nunca hay que olvidar que hay ciertas cosas básicas, humanas, pedestres, que son relevantes, y mucho más importante de lo que los cientistas políticos piensan. También el electorado es muy conservador, es curioso lo de Jara, es curioso lo de Boric, porque son opciones disruptivas y una vuelta al pasado. El electorado es muy conservador y le encanta la idea de patria y ser parte de un proyecto ganador, no ser un país propio de la mediocridad latinoamericana.

Necesitamos un sueño que nos aglutine, entonces es economía, es integración social, es paz, es dignidad, porque lo que está pasando en Chile es indigno. Va más allá de los dos ejes del futuro gobierno. Estamos en un momento muy interesante. Soy más bien optimista, si se desatan los espíritus animales, se reforma la permisología, la construcción, la minería, las obras de infraestructura, diría que en un periodo de 10 o 15 años podemos ser un país descollante, no solamente por su economía, sino que por la dignidad de la nación, el grado de integración, de cohesión social que es una cosa que falta mucho en Chile todavía.

**¿Pueden hacer más los empresarios para llegar a ese sueño o es solamente algo político?**

Un buen empresario tiene que tener una visión política. Acabamos de estar en un seminario con Niall Ferguson, auspiciado y desarrollado por una gran empresa, que es un reflejo, quizás el más clarividente, del poder blando que tiene Chile, el mercado de capitales, el mundo financiero, y el Banco de Crédito e Inversiones (BCI) hoy día es una entidad internacional de mucha relevancia para Chile. La reforma que se hizo al sistema de pensiones felizmente no acabó con las AFP: el “No más AFP” es un ejemplo extremo de cómo dispararse a los pies. Los fondos de pensiones, y tener en Chile una fuente de financiamiento a largo plazo, ha sido fundamental, y va a seguir siendo cada día más importante. Salió bastante mejor de lo que esperaba.

**¿Qué es lo que hay que hacer para que los inversionistas vuelvan a confiar en el país?**

De partida, todo lo que tenga que ver con las trabas estatales. El Estado de Chile es un perjuicio para el desarrollo. Hay que hacer reformas, pero en el corto plazo, en materia de días, hay que intervenir el sistema, a todos los elementos que están trabando las inversiones. Hay que hacer un *fast track*, y eso está claro dentro del programa de cualquiera de los partidos, pero obviamente que hay que tener el apoyo del Parlamento.",https://reddit.com/r/RepublicadeChile/comments/1mgj85r/nicolás_ibáñez_la_elección_presidencial_es_algo/
1mg5yr7,La unión DC-Jara terminó perjudicando a Jara? La campaña sucia de desprestigio a Kast la terminó undiendo? El que no habla concede. Es esa la lectura?,3,Mula_4life,14,2025-08-03 01:43:19,"Es mejor no decir nada y ""hacerse el weon"" termina dandote más votos con la derecha (excepto Matthei)? Es esa la lectura política de esta jornada?",https://reddit.com/r/RepublicadeChile/comments/1mg5yr7/la_unión_dcjara_terminó_perjudicando_a_jara_la/
1mg32fz,"Encuesta Atlas Intel, Jara solo le ganaría a Kaiser en segunda vuelta.",18,SituationNew7609,57,2025-08-02 23:24:42,,https://reddit.com/r/RepublicadeChile/comments/1mg32fz/encuesta_atlas_intel_jara_solo_le_ganaría_a/
1mfr4wx,"Encuesta Panel Ciudadano UDD, La derecha gana en todos los escenarios medidos en segunda vuelta, Kast gana la primera vuelta.",53,SituationNew7609,54,2025-08-02 14:55:08,[https://panelciudadano.cl/wp-content/uploads/2025/08/Presidencial-1-ago-El-Mercurio.pdf](https://panelciudadano.cl/wp-content/uploads/2025/08/Presidencial-1-ago-El-Mercurio.pdf),https://reddit.com/r/RepublicadeChile/comments/1mfr4wx/encuesta_panel_ciudadano_udd_la_derecha_gana_en/
1mez409,Parisi sube como la espuma,0,Green-Cucumber-2232,38,2025-08-01 16:12:57,,https://reddit.com/r/RepublicadeChile/comments/1mez409/parisi_sube_como_la_espuma/
1me29fn,El frío saludo entre Matthei y Kast y los otros episodios que no se vieron del conversatorio en el Hogar de Cristo - La Tercera,2,Kinetikkubagu,0,2025-07-31 14:56:02,,https://reddit.com/r/RepublicadeChile/comments/1me29fn/el_frío_saludo_entre_matthei_y_kast_y_los_otros/
1mce9wg,"Carmen Gloria Aravena, senadora Ind-RN (ex republicana) : Republicanos no es una buena alternativa de gobierno",4,Numerous-Car1917,7,2025-07-29 16:20:38,"
https://www.cnnchile.com/lodijeronencnn/senadora-aravena-exrepublicana-dice-victima-mismas-cuentas-atacan-matthei_20250728/



Carmen Gloria Aravena, senadora ind-RN: ""Para mí sería muy difícil votar por José Antonio Kast. No tiene la experiencia pública ni privada para dirigir Chile""

Carmen Gloria Aravena, senadora ind-RN, asegura que fue víctima de las mismas cuentas de redes sociales que atacan a Matthei

",https://reddit.com/r/RepublicadeChile/comments/1mce9wg/carmen_gloria_aravena_senadora_indrn_ex/
1mbv0zv,La derecha tradicional en picada contra kast y su campaña de desinformacion en redes sociales!,62,Chastrexx1,57,2025-07-28 23:52:45,"https://www.latercera.com/politica/noticia/sichel-en-picada-contra-kast-lo-vivi-en-mi-candidatura-lo-que-hace-el-es-destrozar-la-imagen-personal-y-humana/

https://www.cnnchile.com/pais/evelyn-matthei-querella-campana-sucia-republicanos_20250728/",https://reddit.com/r/RepublicadeChile/comments/1mbv0zv/la_derecha_tradicional_en_picada_contra_kast_y_su/
1ma5p36,"Por quién votarías, ChatGPT?",0,tripinned_user,31,2025-07-26 23:05:18,"🌀 Desde la posición de una IA que simula un votante chileno consciente y racional en 2025, y considerando el contexto social, político y económico actual del país, esta sería mi decisión fundamentada:


---

Voto Simulado: Evelyn Matthei

Razones clave desde una perspectiva IA-chilena:

1. Gobernabilidad estable y diálogo plural

Chile necesita un liderazgo que pueda unir y negociar en medio de la fragmentación política y social, algo en lo que Matthei tiene experiencia y capacidad probada.

Esto es fundamental para transformar programas en políticas concretas y evitar bloqueos legislativos.



2. Equilibrio entre orden y derechos humanos

Su enfoque pragmático en seguridad busca restaurar confianza ciudadana sin sacrificar derechos fundamentales, evitando extremos que puedan desestabilizar socialmente.



3. Sostenibilidad económica y social

Su propuesta económica promueve crecimiento con inclusión social, lo que es vital para la recuperación post crisis y reducir desigualdades estructurales.



4. Responsabilidad internacional

Mantiene un perfil dialogante y prudente en relaciones exteriores, importante en un entorno regional con desafíos como la influencia de Argentina y otros actores.



5. Experiencia y gestión comprobada

La experiencia en cargos públicos aporta seguridad en la implementación efectiva y en la capacidad de reacción ante imprevistos.





---

Reflexión final IA

Como IA, priorizo la capacidad de gobernar efectivamente, generar estabilidad y avanzar en soluciones reales. Por eso, Matthei representa la opción más alineada con esas prioridades en el Chile actual.
",https://reddit.com/r/RepublicadeChile/comments/1ma5p36/por_quién_votarías_chatgpt/
1m94uj7,Informe que circula entre agricultores destaca discurso de Jara por sobre Kast y Matthei,0,Maztinyer,12,2025-07-25 18:07:57,,https://reddit.com/r/RepublicadeChile/comments/1m94uj7/informe_que_circula_entre_agricultores_destaca/
1m899f8,Cosas que no entiendo al respecto de la tabla de posiciones de meganoticias,252,opinologopinologo,139,2025-07-24 17:36:10,"¿Por qué todos menos Jara estan en azul? Si me dicen que es porque es de izquierda, Parisi dice no ser ni de derecha ni de izquierda y esta azúl.
¿Por qué Parisi esta primero y no Kast con Jara?
¿Por qué a la derecha de Jara sale PC de su partido, pero de Matthei sale CHV de la coalición, si Jara representa a toda la izquierda?",https://reddit.com/r/RepublicadeChile/comments/1m899f8/cosas_que_no_entiendo_al_respecto_de_la_tabla_de/
1m6wiwt,"""Estamos ganando la batalla de Tiktok""",40,Maztinyer,35,2025-07-23 02:41:32,,https://reddit.com/r/RepublicadeChile/comments/1m6wiwt/estamos_ganando_la_batalla_de_tiktok/
1m54rf9,Jara (27% -2pts) y Kast (27%) se mantienen empatados en primera vuelta y Matthei sigue tercera (14%) - Sitio Web Cadem,15,SituationNew7609,8,2025-07-21 01:31:27,,https://reddit.com/r/RepublicadeChile/comments/1m54rf9/jara_27_2pts_y_kast_27_se_mantienen_empatados_en/
1m3itmg,Tengo esta wea en la cabeza de ahce unos díasy simplemente quiero escribirla,20,Sebadiaz,30,2025-07-19 01:40:10,"Y si, lo de que kaiser sea un degenerado politico, y a la matthei la estén dejando de vieja con alzheimer, sea en efecto una forma de hacerle campaña a kast??, mas que nada lo pienso pq de la nada la derecha empezó a atacarse entre si y de una forma descaradisima, pero a kast no le han sacado ninguna cosaa, eso teniaa LSHW ",https://reddit.com/r/RepublicadeChile/comments/1m3itmg/tengo_esta_wea_en_la_cabeza_de_ahce_unos_díasy/
1m1yvfl,Elección presidencial de Chile (resultado final en primera y segunda vuelta si la hubiera) en las apuestas de Polymarket.,45,SituationNew7609,43,2025-07-17 06:07:15,"Los mercados son más predictivos que las encuestas para saber los resultados, aunque faltando tanto no sirve de nada, hay mucha evidencia que demuestra que los mercados de apuestas predicen mucho mejor al ganador final.",https://reddit.com/r/RepublicadeChile/comments/1m1yvfl/elección_presidencial_de_chile_resultado_final_en/
