id,title,score,author,num_comments,created,selftext,permalink
1m0aw3u,Sobre incentivar cambio político,0,Traditional_Ball1392,5,2025-07-15 07:56:06,"Esta reflexión tiene dos secciones, un análisis con respecto al populismo y el rol que debería cumplir la izquierda chilena, y después cómo lo aplico al escenario político actual.

***1 Incentivando Cambio Político***

Yo no soy bajo ninguna circunstancia comunista o socialista, pero entiendo que el capitalismo actual conlleva problemas sistémicos necesarios de resolver para el bien común en donde ramas socialistas, de libre mercado, entre otras, deben unirse para hacer al mercado lo más eficiente posible para el bien social. Para que esto se lleve a cabo se deben de dar dos cosas: un incentivo social privado, y uno público. Los actores en el fin privado vendrían siendo los actores del flujo circular del mercado, y en el caso público es el rol del Estado en dicha transacción. Para fines prácticos, consideraré la derecha los defensores conservadores de ideales y narrativas sociales puestas (status-quo ideológico) y la izquierda como lo contrario (el anti-status-quo ideológico). Actualmente estamos viendo una lamentable y abismal ola populista de los movimientos de ultra-derecha que trae más y más gente a resentimientos artificiales para ganar el juego del poder. Yo no soy un emotivista, pero si hay algo que podemos aprender de ellos es una cosa la cual la incorporaré después al argumento en cuál es el rol de la izquierda para no solo balancear el tablero político, sino volver a la razón como motivo político.

El emotivismo indica que las proposiciones morales no son más que expresiones de emoción. Decir “el asesinato está mal” es igual a decir “boo asesinar”, no es “a mí no me gusta el asesinato” ya que este es verificable (verdadero o falso), sino es la expresión de tu intuición y sentimiento en sí. Esto nos lleva a deducir que las narrativas y reglas sociales no son más que la expresión de un sentimiento colectivo con respecto a una forma de actuar. Asimismo, las leyes son la institucionalización de dicho sentimiento colectivo. Lo peligroso de esto es que abre la puerta a los movimientos populistas radicales los cuales dejan de buscar representar el sentimiento colectivo racional, sino que ocupan un discurso que instala una narrativa detrimental para la sociedad, generalmente antagonizante. Como dijo Zizek, “para el populista el problema no es \[el sistema\], sino el actor … el banquero, no el capitalismo; el inmigrante, no la guerra”. Este actor es lamentablemente la víctima del sistema, movido por incentivos instalados sistemáticamente en vez de individuales, genuinos y originales. El populista justamente instala la narrativa de “nosotros contra ellos”, donde el “pueblo” (generalmente la mayoría popular nacional) tiene que pelear contra un grupo pequeño que en teoría es un peligro para ellos. Esto es absolutamente fundamental para todo populista. El mejor ejemplo es Hitler con el Dolchstoßlegende donde instala la antagonización del pueblo judío, la actual narrativa anti-terrorista israelí que antagoniza al pueblo árabe, el “build the wall” de Trump que antagoniza a los inmigrantes mexicanos (entre todas las que tiene contra los árabes, terroristas, franceses, etc.), y la narrativa general republicana actualmente en Chile anti-haitiano, venezolano, colombiano, entre otras nacionalidades. Lo que diferencia al populista del activista anti-status-quo es el incentivo: el populista instala el conflicto, el activista lo reconoce. Resolver un problema artificial es muy fácil, es semántico y retórico; resolver un problema real es más complejo ya que se cuestiona el mismo fundamento sistémico que procura resolver, este el cual la derecha tan bien defiende. Así, el rol de la izquierda en su antagonización retórica no puede ser artificial, sino pragmático y material.

El sentimiento colectivo dejó de ser constituido por incentivos racionales y comenzó a ser semántico, por lo que lamentablemente la izquierda debe de comenzar a jugar en el tablero: dejar el mundo moralista, dejar el mundo intelectual, dejar la estrategia intelectualmente jerárquica. Esto sólo lo puedo mejor representar con otra analogía, esta vez original. Imagínate tienes un árbol de papaya, y te crece una papaya. Esta la ves y sabes, casi por intuición, que es la más jugosa, dulce, de textura fina, y simplemente la mejor papaya del mundo. Tienes en tus manos la papaya. ¿Cuál es el problema? Hay gente que simplemente no le gusta la papaya. La papaya puede ser muchas cosas: la retórica izquierdista, su reputación, o simplemente las ideas. El problema no es trabajar en la papaya, sino construir su gusto.

Fue suficiente de la papaya. *El rol actual de la izquierda es dejar de purificar el agua y comenzar a construir la sed.* Chile (y me atrevo a generalizar, el mundo) lo que menos necesita es más populismo, necesita un movimiento popular racionalista que reconstruya la narrativa democrática (que el sentimiento colectivo sea pro-progreso económico, social y medioambiental) y unificado en la constante evolución ideológica y sistemática.

***2 Lo que podemos sacar de esto***

Boric era y es un gobernante inepto e incapaz, pero supo unificar la retórica poblacional del estallido social en un movimiento político representante. Se debe dejar de antagonizar a actores específicos y reconocer las fallas naturales en el sistema y trabajar en conjunto para resolverlas. Por estas razones es tan importante que Kast no gane porque instala el conservadurismo como narrativa gubernamental; tampoco podemos dejar que Jara gane porque busca reconstruir y desmenuzar el sistema en vez de resolverlo; tampoco podemos dejar que Kaiser gane porque desincorpora el rol del Estado en su radical neoliberalismo. Aunque duela al alma dejar a una votante del “Sí” de Pinochet, es la mejor opción. No necesariamente por un conflicto o convergencia ideológica, sino porque Kast, Kaiser y Jara están fundamentalmente impulsados por un discurso y una estrategia populista (Jara antagonizando a la ultraderecha, Kaiser y Kast criticando a Matthei hasta por las patas, y Kast funcionando como un falso moderado). Entre más de centro sea el siguiente presidente, mejor, porque este cumplirá el rol de reincorporación ideológica para el bien común en vez de continuar con la antagonización de coaliciones políticas. No soy de derecha o izquierda, soy agnóstico a las etiquetas políticas justamente porque se han instalado también como estrategia antagonizadora; esto no es más que una opinión política y estoy abierto a cualquier crítica (siempre y cuando sea con respecto a la idea, no a mi persona).",https://reddit.com/r/RepublicadeChile/comments/1m0aw3u/sobre_incentivar_cambio_político/
1luyect,Que se siente votar como veneco?,441,Fun_Fan_1507,292,2025-07-08 20:49:46,"Titulo bait jaja pero en serio, los votantes de derecha que se consideran así mismos patriotas o nacionalistas, y que por consiguiente se encuentran en contra de los inmigrantes o la inmigración irregular por lo menos, como concilian que sus candidatos estén apelando a los mismos extranjeros que se supone que deberían expulsar? Es una situación un poco paradójica.",https://reddit.com/r/RepublicadeChile/comments/1luyect/que_se_siente_votar_como_veneco/
1ltlnpj,Encuesta Cadem 6 de Julio: La derecha se estanca,2,Maztinyer,33,2025-07-07 06:05:31,,https://reddit.com/r/RepublicadeChile/comments/1ltlnpj/encuesta_cadem_6_de_julio_la_derecha_se_estanca/
1lt1ecf,La gran decisión de Evelyn Matthei - La Tercera,6,1750gt16,14,2025-07-06 14:35:06,"La gran definición política que enfrenta Evelyn Matthei es si gira hacia el centro, e incluso a la centroizquierda, o no.

Esa es la encrucijada de fondo que se ha tomado la discusión al interior de Chile Vamos y del comando de la exalcaldesa.

La opción se empezó a sopesar antes de las primarias, cuando los sondeos empezaron a dar por ganadora a la abanderada del PC, **Jeannette Jara**, cuyo triunfo dejó huérfano al centro político. Y la visibilizó este viernes **Juan Luis Ossa**, coordinador programático de la exedil, en *Desde La Redacción* de **La Tercera**, al plantear que “hay que hablarle al centro e incluso a la centroizquierda que está desencantada”.

Pero no hay acuerdo.

En el corazón de la campaña admiten que, además de Ossa, personeros influyentes, como los exsubsecretarios **Rodrigo Ubilla** y **Claudio Alvarado,** comparten la misma tesis política. Y que otros, como la periodista **Fernanda Otero** y el extimonel UDI **Ernesto Silva,** tienen otra visión. Por ejemplo, que el centro político se vació y que, si bien hay que elegir un posicionamiento, este debiera darse no en clave política, sino que conectando con los principales problemas de las personas.

Pero sí coinciden en dos puntos: en que es imposible que Matthei crezca hacia la derecha más dura, porque ese espacio está ocupado hasta el último milímetro por el republicano **José Antonio Kast** y **Johannes Kaiser,** de Nacional Libertarios, y que los cinco puntos que le arrebataron en los últimos sondeos son prácticamente irrecuperables.

Como contrapartida, hacen ver que la exedil tiene a su haber el hecho de ser la única abanderada de derecha que puede captar el voto del centro -el voto moderado- y también el sufragio de una parte del Socialismo Democrático que quedó sin representación tras la derrota de **Carolina Tohá**, donde observan que si bien no están dispuestos a salir del clóset, sí podrían sufragar por ella sin problemas en la reserva de la urna de votación.

De ahí que se esté poniendo especial atención a los análisis de figuras del Socialismo Democrático, entre ellas **Ernesto Ottone** \-quien ha dicho por estos días que “no se puede ser demócrata y marxista leninista”-, para conocer el virtual comportamiento de ese sector.

Los riesgos que avizoran para dar el giro no son menores. El principal es la pérdida de parte del electorado de Chile Vamos, cuyas bases son celosamente de derecha, con lo que un viraje de ese calibre podría arriesgar entregarle las llaves de ese sector a Kast. Por eso se habla de que es una definición “estructural”, que requiere de “coraje político” y que involucra estructuralmente a los tres partidos de la coalición.

A ello obedece la tensión.

De ahí que el presidente de la UDI, **Guillermo Ramírez**, saliera a afrontar la disyuntiva bajo el siguiente principio: “Evelyn Matthei es una mujer de derecha, con ideas de derecha, pero que entiende que en las reformas importantes es necesario construir grandes mayorías”, dijo a El Dínamo. Y que “esa ponderación y capacidad de escucha de las ideas del adversario le hacen sentido a un mundo moderado”.

Para el comando -en este minuto- la campaña se juega en la calle y también en la élite, donde buscan resguardar la candidatura de Matthei. Por ello consideran fundamental como señal política el apoyo otorgado por figuras de la ex Concertación, como **René Cortázar**, **Mariana Aylwin, José Pablo Arellano, Jorge Schaulsohn, Jorge Burgos, Pablo Piñera, Pedro García** y **Clemente Pérez**, y el respaldo de Amarillos. Flujo que esperan que continúe con Demócratas y su precandidata presidencial, la senadora **Ximena Rincón**.

“Esto se va a ganar en el terreno. Va a haber que correr por dos caminos: mantener a la gente de derecha y centroderecha, porque uno no puede renunciar a sus principios y valores, y también crecer hacia el centro”, sostiene el diputado UDI **Juan Manuel Fuenzalida**.

Si bien en Chile Vamos existe la convicción de que cuentan con la mejor carta a la Presidencia, apuntan sus dardos a la falta de una estrategia clara. Y sostienen, incluso, que el diseño se parece más a una campaña municipal que a una presidencial.

“No resistimos dos semanas más a la baja”, enfatiza una fuente, que reclama decisiones profundas y rápidas.

La inquietud la visibilizó públicamente **Pablo Longueira** \-el histórico excoronel de la UDI-, quien aparte de plantear la idea de ir derechamente por un gobierno de unidad nacional, alertó que Matthei “tiene 15 días muy decisivos” para posicionar su opción.

En el comando -sin embargo- los plazos son más amplios. Hablan de julio como el mes clave, por la presión, además, que van a empezar a imponer los candidatos al Parlamento.

# La cita en el O’Higgins

El martes 1 de julio -cuando ya se habían masticado los resultados de las primarias oficialistas-, **Matthei** llegó hasta el histórico restaurante O’Higgins, ubicado al frente del Congreso, en Valparaíso, para marcar el puntapié de la recta final de su campaña a La Moneda, junto a los diputados de Chile Vamos. “Estoy convencida de que vamos a ganar”, les dijo.

Pero esa noche entre los asistentes había preocupación.

La baja en las encuestas, que ya acumula cuatro semanas, está generando un fuerte ruido en las bancadas de los tres partidos de Chile Vamos. Las cuentas indican que falta un poco más de cuatro meses para la primera vuelta y, por tanto, un escaso tiempo para revertir la tendencia que muestran los sondeos.

“La idea era entregarle nuestro apoyo incondicional, cosa que hicimos, pero también decirle la verdad, que el asunto no estaba bien”, comenta una fuente.

Pero todo se frenó tras la intervención del diputado y jefe de bancada de RN **Miguel Mellado**, quien le expresó con franqueza sus aprensiones por el rumbo de la campaña. De acuerdo a distintas fuentes -el parlamentario declinó pronunciarse sobre este episodio-, le hizo ver que no había relato; que no era conveniente que ella hablara siempre, porque eso la exponía y la llevaba a equivocaciones, y que los voceros se querían llevar la pelota para la casa.

Eso molestó a Matthei. Algunos presentes relatan que la candidata -a quien algunos han visto bajo más presión- no ocultó su incomodidad y reaccionó diciendo que no iba a permitir ese tipo de cuestionamientos.

“Con esa parada de carros, nadie se atrevió a criticar nada más”, comenta un parlamentario.

# La estrategia

Pese a los tironeos por un cambio de rumbo, en la sede central del comando de Matthei -en Enrique Foster, Las Condes- se asegura que la estrategia gruesa se mantiene sin grandes variaciones, salvo la decisión táctica de diferenciarse de Kast y de Jara, sin entrar en disputas.

Bajo esos lineamientos, la performance de la recta final se inauguró la misma noche de las primarias, día en que la exalcaldesa apareció rodeada de mujeres, apuntando al voto femenino, que es esquivo para Kast y donde Jara tiene llegada. Una estrategia que reforzó hacia ese electorado esta semana con el aterrizaje de la exsubsecretaria de Salud Pública **Paula Daza**, como vocera.

Pero el asunto ha tenido traspiés. Partiendo porque para muchos en Chile Vamos Matthei perdió una oportunidad única para presentarse esa noche ante el país como la abanderada que le iba a impedir al gobierno de **Gabriel Boric** su continuidad y también para hacer una invitación amplia al cambio. Y, luego, por el error de calificar a Johannes Kaiser como “mucho más respetuoso de las mujeres que Kast, porque tiene una cosa mucho más liberal”, olvidando que el libertario tiene un amplio registro en redes sociales con frases polémicas hacia las mujeres, que incluso lo apartaron de republicanos en la campaña de 2021 para no perjudicar a Kast.

Aparte de las mujeres, el diseño del comando apunta a los jóvenes -pues los datos internos indican que se están yendo más con Kaiser, quien ha capitalizado la rabia ante la delincuencia y la falta de oportunidades-, y a los independientes que el 16 de noviembre irán obligados a votar. El foco es seguridad, migración, crecimiento económico y agenda laboral, donde no solo se espera un choque entre Matthei y Jara, pues ambas fueron ministras del Trabajo, sino que también a nivel de habilidades blandas, en la que ambas tienen destrezas y han marcado estilos.

“Las encuestas son volátiles e incluso contradictorias. Lo importante aquí es que somos la coalición más gravitante de la derecha, con una relevante fuerza territorial en parlamentarios, gobernadores, alcaldes, concejales y cores. Y lo que viene, de ahora en adelante, es un gran despliegue de Evelyn Matthei, quien en estos días se encuentra en La Araucanía, y también de Chile Vamos, para dar a conocer nuestras propuestas en cada rincón de Chile. Eso va a marcar la diferencia”, sostiene el diputado de Evópoli Francisco Undurraga.

# La apuesta de Kast

Quien no está dispuesto a variar su diseño de campaña -que le ha permitido encumbrarse en los primeros lugares de las encuestas- es **José Antonio Kast**. No han definido todavía si van a inscribir la candidatura antes del cierre del plazo, el próximo 18 de agosto. Pero sí están claros en que el esquema sigue invariable en seguridad, migración ilegal y crecimiento económico.

“Lo único que ha cambiado es que ahora tenemos un adversario conocido en el oficialismo. Pero no vamos a hacer foco en el tema de si Jeannette Jara es comunista o no, porque eso es parte del inventario. Sí en que es continuadora de este gobierno. Pero nuestra hoja de ruta no se altera ni por los candidatos que tenemos al frente, ni por las encuestas, ni por el resultado de las primarias”, dice una fuente.

Tampoco están dispuestos a tener disputas con Matthei ni a caer en provocaciones. “Sabemos -asegura una fuente- que ella cambió de estrategia y nuestra estrategia es no hacernos cargo de su estrategia”.

Prueba de ello es que Kast solo sostuvo que “no voy a marcar la diferencia con alguien que es opositor al gobierno”, por la comparación que hizo la exedil con Kaiser sobre la píldora anticonceptiva.

Ya pusieron en marcha la maquinaria territorial, que cuenta con casi una decena de alcaldes, más de 300 concejales y unos 60 consejeros regionales. Y están en plena negociación de la plantilla parlamentaria con los Nacional Libertarios y Social Cristianos, partido que depuso la candidatura de **Francesca Muñoz** el domingo, tras conocerse la victoria de Jara.

# La batalla de Kaiser

El plan de Nacional Libertarios, en tanto, es convertir a Kaiser en el rostro que enfrentará al Partido Comunista y a Jara en esta presidencial.

Una estrategia que le puede acarrear costos electorales, pero que también -estiman- los puede beneficiar.

En esas filas hay claridad de que al presentarse en una línea más extrema, el mayor beneficiado podría ser Kast, porque quedaría en una postura más moderada. Pero -afirman- que no están haciendo ese tipo de cálculos.

“Siempre planteamos que íbamos a iniciar nuestra campaña cuando tuviéramos al frente a la persona que ganara la primaria del oficialismo. Ganó la exministra Jara, del Partido Comunista, y vamos a dar una batalla cultural. Estamos dispuestos a ese desafío”, sostiene **Cristián Labbé**, jefe de campaña del abanderado nacional libertario.

El diseño contempla la proclamación de Kaiser -el próximo 12 de julio, con asistencia presencial y telemática para incluir a las regiones-, donde se va a dar a conocer el plan de gobierno, las propuestas y los equipos de trabajo.

En este complejo escenario, los comandos están ajustando sus piezas para la recta final, en la que Matthei y Kast disputan no solo el voucher para la segunda vuelta presidencial, sino que también la hegemonía de la derecha.",https://reddit.com/r/RepublicadeChile/comments/1lt1ecf/la_gran_decisión_de_evelyn_matthei_la_tercera/
1lrib66,Hay alguna explicacion racionale para la increible inoperancia de la derecha,0,elmisteriosoviaje,47,2025-07-04 14:07:05,"Viendo la escena politica en el ultimo tiempo, es posible descifrar como la derecha puede hacerlo tan mal?, considerando:

-La pesima campaña de kast en segunda vuelta en la pasada eleccion

-Perder la posibilidad de una consolidacion de la constitucion del 80, proponiendo algo q si tomara algo de las demandas existentes en vez de meter sus antojos (IMO ahi la derecha lo perdio todo)

-Las polemicas innecesarias de matthei

-Q a pesar de ser una figura politica de 30 años de experiencia, con excelente educacion, con asesores comunicacionales y todo, se tire la misma opinion q una vieja ignorante en el año 89 en torno al golpe??, ninguna reflexion mas profunda??? 

-La estupidez del casi tongo de primarias q matthei queria a armar

-Q se levante a kaiser, un equivalente a boric, por lo inoperante y sin curriculum, como candidatura seria

-Q se tome en serio como intelectual al hermano de kaiser, q siendo generoso se le puede considerar mediocre, q plagia el tema central de su ultimo libro

-Los 11 (?) Voceros de matthei, en q planeta a alguien se le ocurre q es buena idea

-tantas mas

Parece q lo unico inteligente del sector es el silencio de kast ante casi todos los ultimos eventos, lo q es bien triste

Ahora estoy viendo q 99% de personeros d derecha van a darle majaderamente con el anticomunismo, adormeciendo la oreja del votante medio, anulando el mensaje y sin poder dejar en claro pq un gobierno pc es un peligro tan grande 

Mas encima, la izquierda puede q llegue a lista unica parlamentaria, seria la derrota total de la derecha, y el fin de la constitucion de los 80, con la reforma de quorum simple para modificarla q hicieron hace un tiempo

No se si en otros paises q llego un populista de izquierda al poder paso esto mismo: q la derecha por su estupidez es factor importante en su triunfo 

Todo esto veo q esta dando una posibilidad real de tener un gobierno comunista, en el q los proximos 20 años vamos a estar en la basura de la basura como pais, todo por tener gente tan weona en posiciones de poder en la derecha

Como se entiende tanta estupidez?",https://reddit.com/r/RepublicadeChile/comments/1lrib66/hay_alguna_explicacion_racionale_para_la/
1lr4jqb,Jara casi duplica al 2do + 3er lugar,138,Maztinyer,141,2025-07-04 00:51:27,,https://reddit.com/r/RepublicadeChile/comments/1lr4jqb/jara_casi_duplica_al_2do_3er_lugar/
1lqp2m9,Terrorismo de Derecha,151,Maztinyer,128,2025-07-03 14:04:21,,https://reddit.com/r/RepublicadeChile/comments/1lqp2m9/terrorismo_de_derecha/
1lp8fkn,Ahora que la derecha tiene asegurada la eleccion presidencial,3,ozzraven,48,2025-07-01 18:51:57,"¿Como evitaran farrearse esta oportunidad? Porque el unico peligro que veo, es que pase kaiser a segunda vuelta o que a Matthei le den mas Bidenazos.

¿Como van a contrarrestar la propaganda mula xenofoba que les invita a votar por jara?",https://reddit.com/r/RepublicadeChile/comments/1lp8fkn/ahora_que_la_derecha_tiene_asegurada_la_eleccion/
1lo8sbg,Qué opinan de esta analogía?,0,Glad-Philosopher8261,14,2025-06-30 15:21:21,Kaiser es Milei. Kast es Bullrich. Matthei es Larreta y así?,https://reddit.com/r/RepublicadeChile/comments/1lo8sbg/qué_opinan_de_esta_analogía/
1lntcar,Cadem semana pasada (segunda vuelta Kast vs Jara),20,SituationNew7609,26,2025-06-30 00:54:46,"Jara le ganaría solo a Kaiser, hasta Parisi le ganaría a Jara.",https://reddit.com/r/RepublicadeChile/comments/1lntcar/cadem_semana_pasada_segunda_vuelta_kast_vs_jara/
1lnt2xd,La Cadem de la semana pasada.,9,SituationNew7609,6,2025-06-30 00:42:03,"Hicieron unos escenarios horribles de segunda vuelta, no tomaron Kast vs Jara aparentemente, porque su página está caída.",https://reddit.com/r/RepublicadeChile/comments/1lnt2xd/la_cadem_de_la_semana_pasada/
1lnro5l,"Bueno, parece que va a ganar Jara, o sea la derecha ya ganó.",57,SituationNew7609,79,2025-06-29 23:36:40,"Eso po, parte del voto que iba a ir a Tohá se puede ir a Matthei o algo así, como sea, Jara no va a ganar.",https://reddit.com/r/RepublicadeChile/comments/1lnro5l/bueno_parece_que_va_a_ganar_jara_o_sea_la_derecha/
1ll65y0,¿Qué opinan los mejores puntajes de Chile respecto a las candidaturas presidenciales?,5,Various-pain3,128,2025-06-26 18:28:37,"• Cuando Matthei fue a la Universidad Católica, cuna de los puntajes PAES más altos en todas sus carreras (hasta la carrera más rara corta arriba de 700), fue recibida por el colectivo ""Memoria UC"" con fotografías de estudiantes de la casa de estudios detenidos desaparecidos en dictadura.

• Cuando Jara fue a la Universidad Católica, fue recibida por más de 500 estudiantes, muchos quedaron afuera de la sala y no tuvo ningún percance ni ""funa"", incluso realizó un punto de prensa.

Esto sería algo normal en la Chile o en la USACH, pero en la UC no...  ¿Será que Jara ha logrado desmarcarse del PC y lograr una transversalidad?",https://reddit.com/r/RepublicadeChile/comments/1ll65y0/qué_opinan_los_mejores_puntajes_de_chile_respecto/
1li5xrg,"Al final Kaiser si hizo ver a Kast como moderado, y 67% afirman que jamás votarían por Jara.",70,SituationNew7609,115,2025-06-23 04:00:15,,https://reddit.com/r/RepublicadeChile/comments/1li5xrg/al_final_kaiser_si_hizo_ver_a_kast_como_moderado/
