id,title,score,author,num_comments,created,selftext,permalink
1jyc4f9,"La opción Kaiser, Kast y Parisi son realmente una opción presidencial o solo con candidaturas testimoniales?",7,Resident-Afternoon12,65,2025-04-13 17:50:53,"Para la gente mediana instruida y luego de ver lo que pasó con el gobierno de Boric, parece ser que el problema principal de Chile es la falta de liderazgo, experiencia y lo más importante que tenga capacidad para llegar acuerdos para sacar reformas relevantes y volver a ser un país serio. No hay otra forma. No existe la posibilidad que un presidente en Chile empiece a gobernar por decretos como lo está haciendo Trump en USA. Parisi dijo el otro día que si Bolivia no deja repatriar ilegales les iba a cortar el acceso a petróleo y gas natural. Kaiser quiere hacer un campamento de refugiados en el norte para ilegales. Kast a propone detención de todos los ilegales que no quieren abandonar el país. Y bueno así suman y suman propuestas que no pasan un examen de constitucionalidad. Entiendo que la masa todo esto suena muy bonito. Pero acá en Reddit veo muchos que siguen repitiendo y repitiendo que apoyan aunque sepan que esos candidatos no pueden hacer nada, más que prometer cosas imposibles de cumplir. Sueñan bonito pero pueden generar más malestar al fin del día.",https://reddit.com/r/RepublicadeChile/comments/1jyc4f9/la_opción_kaiser_kast_y_parisi_son_realmente_una/
1jvmg9w,"¿Cuando vamos a reconocer que la ""extrema derecha"" tenía razón en el asunto de la inmigración?",3,BuhoBasado,61,2025-04-10 02:37:01,"No me salgan con Cúcuta porque eso lo hizo la derecha que llamaba extrema derecha a los que se oponían a tales medidas.

Kaiser se hizo conocido por hablar de eso y solo por eso capaz que gane , aunque descubrieran que no ha terminado 4to medio. ¿Que argumento serio se da contra eso sin parecer desesperado?

Ya era.

",https://reddit.com/r/RepublicadeChile/comments/1jvmg9w/cuando_vamos_a_reconocer_que_la_extrema_derecha/
1ju19oj,lo unico culto que tiene kaiser es que sabe aleman,19,Medical_Carry_6034,63,2025-04-08 01:54:57,,https://reddit.com/r/RepublicadeChile/comments/1ju19oj/lo_unico_culto_que_tiene_kaiser_es_que_sabe_aleman/
1js9gw7,“Tu mayor aporte fue proponer el día de la longaniza”: MEO responde a comentarios de Johannes Kaiser,76,ComprehensiveBand752,36,2025-04-05 19:01:56,,https://reddit.com/r/RepublicadeChile/comments/1js9gw7/tu_mayor_aporte_fue_proponer_el_día_de_la/
1jrn5s9,Candidato a la continuidad del proyecto frenteamplista.,500,Ok-Interest-7641,106,2025-04-04 22:25:55,Yo cacho que si fusionamos a Kaiser con Winter saldría una especie de Navarro intelectualmente hablando. ,https://reddit.com/r/RepublicadeChile/comments/1jrn5s9/candidato_a_la_continuidad_del_proyecto/
1jofsxr,Kast o Kaiser (,0,CertainWeekend3646,35,2025-03-31 23:15:11,"En las elecciones pasadas apoyé a Kast y lo sigo apoyando. 
Lo particular que me hace reafirmar mi postura es la tranquilidad y sabiduria con la que Kast aborda las preguntas w***nas de algunos periodistas, lo cual me hace ver que toma desiciones desde la razón y no desde la rabia o emociones fuertes. A parte de que es un hombre empresario, padre de familia y profesional, a diferencia de Kaiser que por lo general se ve mas impulsivo y que tomaría muchas desiciones desde la rabia o emociones fuertes, lo cual no me da seguridad. Pero quiero saber que piensan ustedes.",https://reddit.com/r/RepublicadeChile/comments/1jofsxr/kast_o_kaiser/
1jo4zef,"Johannes Kaiser en Estado Nacional, pone en duda la vacunación en recién nacidos con argumentos antivacunas",94,Ok-Interest-7641,147,2025-03-31 15:49:22,,https://reddit.com/r/RepublicadeChile/comments/1jo4zef/johannes_kaiser_en_estado_nacional_pone_en_duda/
1jnkqry,Johannes Kaiser propone eliminar el Ministerio de la Mujer: “No está haciendo ningún aporte medible”,158,Maztinyer_3,204,2025-03-30 20:44:26,,https://reddit.com/r/RepublicadeChile/comments/1jnkqry/johannes_kaiser_propone_eliminar_el_ministerio_de/
1jnfrs5,Johannes Kaiser propone cortar ayuda a los agricultores,21,Maztinyer_3,51,2025-03-30 17:07:08,,https://reddit.com/r/RepublicadeChile/comments/1jnfrs5/johannes_kaiser_propone_cortar_ayuda_a_los/
1jndr7u,El Gobierno: La Película,1,hospitallers,34,2025-03-30 15:35:19,,https://reddit.com/r/RepublicadeChile/comments/1jndr7u/el_gobierno_la_película/
1jjxzks,Republicanos avanza en negociación parlamentaria con libertarios y apuestan a que Kaiser se baje de la presidencial - La Tercera,9,Maztinyer_3,9,2025-03-25 23:40:22,,https://reddit.com/r/RepublicadeChile/comments/1jjxzks/republicanos_avanza_en_negociación_parlamentaria/
1jj6mt4,Cadem y UDD: Kaiser se estanca y se le hace difícil volver a crecer - La Segunda.com,8,Maztinyer_3,15,2025-03-25 00:25:37,,https://reddit.com/r/RepublicadeChile/comments/1jj6mt4/cadem_y_udd_kaiser_se_estanca_y_se_le_hace/
1jj0cgb,Patriotas en el segundo día del gobierno de Johannes Kaiser 卐,0,Nebitron,7,2025-03-24 20:03:02,"No tengo pruebas, pero tampoco dudas…",https://reddit.com/r/RepublicadeChile/comments/1jj0cgb/patriotas_en_el_segundo_día_del_gobierno_de/
1jht9qh,como ven el futuro de chile,12,Medical_Carry_6034,79,2025-03-23 06:44:56,"hola amigos, sabiendo que es probable que salga un candidato de derecha de presidente y seguramente en general veamos un ambiente político medio de derecha (por favor que no salga kaiser, cualquier menos kaiser) como creen que le vaya al pais en todo ámbito, económico, social, educativo, cultural, hasta deportivo si les interesa durante el proximo mandato presidencial, en mi caso siempre me gusta pensar que iremos a mejor, ayuda en algo? no pero soy mas feliz teniendo fe y esperanza en que el mañana va a cambiar",https://reddit.com/r/RepublicadeChile/comments/1jht9qh/como_ven_el_futuro_de_chile/
1jgqjp1,Encuesta B&W agita la carrera presidencial y hace sonreír a Kaiser y Tohá,2,Resident-Afternoon12,8,2025-03-21 20:22:35,"https://preview.redd.it/r43qamr9q3qe1.png?width=463&format=png&auto=webp&s=f2324588d0d51e125d8f5ebda8d28dad47719c7f

[https://cooperativa.cl/noticias/pais/politica/presidenciales/encuesta-b-w-agita-la-carrera-presidencial-y-hace-sonreir-a-kaiser-y-toha/2025-03-21/150545.html](https://cooperativa.cl/noticias/pais/politica/presidenciales/encuesta-b-w-agita-la-carrera-presidencial-y-hace-sonreir-a-kaiser-y-toha/2025-03-21/150545.html)",https://reddit.com/r/RepublicadeChile/comments/1jgqjp1/encuesta_bw_agita_la_carrera_presidencial_y_hace/
1jgjafw,Encuesta Black & White da por ganador a Johannes Kaiser en la primera vuelta: Matthei y Tohá empatan en el segundo lugar,8,Maztinyer_3,30,2025-03-21 15:19:47,,https://reddit.com/r/RepublicadeChile/comments/1jgjafw/encuesta_black_white_da_por_ganador_a_johannes/
1jfgtgz,Cuál candidato creen que gane las elecciones de noviembre?,70,arsx_itn_00,151,2025-03-20 04:23:25,"1.Johannes Kaiser - Partido Nacional Libertario
2.José Antonio Kast - Partido Republicano
3.Rojo Edwards - Partido Social Cristiano
4.Marc Etienne Celestin - Partido Pastero Chileno
5.Alberto Undurraga - Democracia Cristiana
6.Carolina Tohá - Partido por la Democracia
7.Eduardo Artés - Partido Comunista Chileno, Partido Comunista Revolucionario y Unión Patriótica
8.Evelyn Matthei - Unión Demócrata Independiente 
9.Jaime Mulet - Federación Regionalista Verde Social 
10.Vlado Mirosevic - Partido Liberal

(No están puestos en un orden)",https://reddit.com/r/RepublicadeChile/comments/1jfgtgz/cuál_candidato_creen_que_gane_las_elecciones_de/
1je42jl,Diputado Johannes Kaiser sufre robo de notebook en servicentro de la Costanera Norte,30,ozzraven,26,2025-03-18 12:44:47,,https://reddit.com/r/RepublicadeChile/comments/1je42jl/diputado_johannes_kaiser_sufre_robo_de_notebook/
1jd00s6,Kaiser propone indultar a violadores de derechos humanos y pone en duda culpabilidad de Miguel Krassnoff,19,Maztinyer_3,110,2025-03-17 00:23:38,+20% de rechazo,https://reddit.com/r/RepublicadeChile/comments/1jd00s6/kaiser_propone_indultar_a_violadores_de_derechos/
1jcy0p6,Los votantes de Johannes Kaiser y la normalización del horror,0,Aureliorogelio,69,2025-03-16 22:49:10,"Es impactante ver cómo en Chile hay personas que votan por personajes como Johannes Kaiser, quien no solo ha relativizado crímenes de la dictadura, sino que también ha lanzado comentarios misóginos, xenófobos y negacionistas sin ningún pudor.

¿Por qué hay gente que lo apoya?

Porque no les importa la historia: Creen que la dictadura ""no fue para tanto"" o directamente la justifican. Muchos votantes de Kaiser han sido educados con la idea de que los crímenes de lesa humanidad fueron un ""mal necesario"".

Porque el odio vende: La política de la ultraderecha se basa en canalizar el resentimiento social contra minorías, mujeres o extranjeros, en lugar de contra las verdaderas élites que los explotan. Kaiser es un maestro en explotar esa rabia.

Porque se sienten representados: Su discurso no es un ""error"" o ""exageración"". Muchos de sus votantes realmente piensan así y lo ven como alguien que ""se atreve a decir lo que ellos piensan"".

Porque la impunidad les enseñó que todo se puede relativizar: En Chile, torturadores como Krassnoff siguen teniendo defensores, y los crímenes de la dictadura aún se minimizan. En ese contexto, no sorprende que alguien como Kaiser pueda hacer carrera política.


El hecho de que alguien así tenga apoyo no es solo un problema electoral. Es un síntoma de una sociedad donde la memoria histórica está en disputa y donde el odio sigue siendo una herramienta política rentable.

",https://reddit.com/r/RepublicadeChile/comments/1jcy0p6/los_votantes_de_johannes_kaiser_y_la/
1jc58u8,Quiénes son los favoritos para la próxima elección presidencial en Chile ?,8,Argentinotriste,39,2025-03-15 21:08:56,"Buenas tardes amigos trasandinos.

Soy de Argentina y tengo curiosidad por saber quien puede ser el próximo presidente de Chile.

Hasta donde sé, el actual gobierno de izquierda es un auténtico fracaso, sobre todo en economía, seguridad e inmigración.

Entonces entiendo que el próximo presidente sería alguien de derechas, no ?

He escuchado que los candidatos que tienen buenas posibilidades son Kaiser y Kast. 

Pero bueno, quien mejor que ustedes para aclararme esto ?

Saludos del otro lado de la cordillera.
",https://reddit.com/r/RepublicadeChile/comments/1jc58u8/quiénes_son_los_favoritos_para_la_próxima/
1jb7wci,Péndulo,603,Maztinyer_3,56,2025-03-14 16:24:33,,https://reddit.com/r/RepublicadeChile/comments/1jb7wci/péndulo/
1j9xmvu,Johannes Kaiser vs Kast,30,RealisticMine6962,214,2025-03-12 23:08:37,"El otro día hablabamos con amigos sobre los precandidatos presidenciales. Todos concordamos que esta de la perra el elenco para el 2026. 

Entremedio solte esta pregunta. 
Supongamos que Chile entra en su ""Little Dark Age"" (una forma elegante de decir época oscura a nivel político y social digno de 1984 o la alemania Nazi"" y contra todo pronóstico la final de las presidenciales termina siendo Jose Antonio Kast vs Johannes Kaiser. 


Sé que es poco probable (por no decir imposible), pero háganse esta duda...¿Que creen que pasaría a nivel social y político en un escenario así de horrendo?


Yo creo que quedaría la pura cagada y punto. ",https://reddit.com/r/RepublicadeChile/comments/1j9xmvu/johannes_kaiser_vs_kast/
1j8u8gc,"Por favor, que alguien haga algo así con Boric, con Kaiser, con el Vardoc, quien sea pero háganlo.",15,DoctorMoth342,14,2025-03-11 16:03:01,Sería el pináculo de la comedia,https://reddit.com/r/RepublicadeChile/comments/1j8u8gc/por_favor_que_alguien_haga_algo_así_con_boric_con/
1j68dbh,“Johannes Kaiser y José Antonio Kast son un peligro para las mujeres y sus derechos”: Vocera de Coordinadora Feminista 8M respecto a campaña presidencial de republicanos,11,Maztinyer_3,42,2025-03-08 03:40:29,,https://reddit.com/r/RepublicadeChile/comments/1j68dbh/johannes_kaiser_y_josé_antonio_kast_son_un/
1j4hhid,Kast es fuera de webeo la mejor opción presidencial,0,SmokerMMI,78,2025-03-05 23:29:43,"Absolutamente todos los demás son directamente weones o mid.

Matthei: Una copia de todas las propuestas de Kast pero peor, y ya ha demostrado ser inoperante en el pasado.

Toha: La principal responsable del problema de seguridad actual de Chile, cualquier cosa que te venda es mentira porque ya estuvo en el poder.

Kaiser: Un weon que vendería al país o lo llenaría de negros con tal de que aumente un 0.1% la economía.

Mirosevic:",https://reddit.com/r/RepublicadeChile/comments/1j4hhid/kast_es_fuera_de_webeo_la_mejor_opción/
1iz2sfz,Qué opinan de tener una empresa estatal de energía?,93,Maztinyer_3,200,2025-02-27 00:25:20,"Increíble que este wn habla todos los días de Kast, Kaiser y Matthei",https://reddit.com/r/RepublicadeChile/comments/1iz2sfz/qué_opinan_de_tener_una_empresa_estatal_de_energía/
1iy0xju,Las razones tras la alianza política que exploran Kast y Kaiser de cara a las parlamentarias,5,Maztinyer_3,7,2025-02-25 17:45:13,,https://reddit.com/r/RepublicadeChile/comments/1iy0xju/las_razones_tras_la_alianza_política_que_exploran/
1ixb7hn,"Fue lo que paso en Viña anoche con el humorista, un reflejo del pensamiento social actual?",0,Sould67,10,2025-02-24 19:54:19,"La pregunta (aunq parezca obvia) es; ¿porque?  

La rutina del humorista innegablemente fue muy aburrida, con modismos que solo un venezolano podría entender pero pasando al tema en cuestión y dejando de lado al humorista. 

Lo que paso anoche es un reflejo de la actual postura de los Chilenos hacia los Venezolanos? Es xenofobia? Es un problema solo contra el pueblo venezolano? Es envidia tal vez? Falta de empatia contra una nación golpeada por regímenes políticos?

Pienso que estamos (fuera de lo económico) cada vez mas cerca de convertinos en una especie de Estados Unidos pobre, imagínense eventualmente llega a ser electo johannes kaiser como presidente. 

Lo pregunto desde la mirada social-política 

(Discutamos con respeto gente) 
",https://reddit.com/r/RepublicadeChile/comments/1ixb7hn/fue_lo_que_paso_en_viña_anoche_con_el_humorista/
1ixagt3,"""Vamos a entregar La Moneda a la izquierda"": Moreira culpa a Kast y Kaiser por división en la derecha",23,ozzraven,30,2025-02-24 19:24:18,,https://reddit.com/r/RepublicadeChile/comments/1ixagt3/vamos_a_entregar_la_moneda_a_la_izquierda_moreira/
1iula6z,"Chile, Axel Kaiser opina sobre Milei en estafa $LIBRA - La Voz de Chile",1,jazzmiroquai,1,2025-02-21 07:24:37,,https://reddit.com/r/RepublicadeChile/comments/1iula6z/chile_axel_kaiser_opina_sobre_milei_en_estafa/
1itm6ec,"En Argentina vinculan ""criptogate"" de Milei con jefe de fundación en la que Axel Kaiser es subdirector",10,extremoenpalta,3,2025-02-20 01:08:39,,https://reddit.com/r/RepublicadeChile/comments/1itm6ec/en_argentina_vinculan_criptogate_de_milei_con/
1ir2prx,"Ahora que se está viralizando el cagazo de Milei, les quisiera recordar que hace 3 años, la estafa ""Magenta Capital"" fue promocionada por el Diputado Johannes Kaiser. Hoy, su fundador, Sebastián Hoppe, está formalizado por los delitos de apropiación indebida y estafa",436,Maztinyer_3,169,2025-02-16 21:11:23,,https://reddit.com/r/RepublicadeChile/comments/1ir2prx/ahora_que_se_está_viralizando_el_cagazo_de_milei/
1ioolnj,Alcalde Jadue analiza irrupción de Kaiser: “Hemos tenido dos guerras mundiales propiciadas por ese tipo de perfiles”,29,Maztinyer_3,78,2025-02-13 17:36:26,,https://reddit.com/r/RepublicadeChile/comments/1ioolnj/alcalde_jadue_analiza_irrupción_de_kaiser_hemos/
1iomldv,¿Creen que si saliese un candidato como Kaiser o Kast va a hacer cambios abruptos al país?,8,Dry-Newt912,55,2025-02-13 16:12:41,"Yo había hecho un viaje de estudio para las sedes de gobierno en Santigo. Y al primero que fuimos fue a la dirección de presupuesto, donde nos dieron una pincelada del presupuesto estatal de Chile. En cierto punto nos dieron la oportunidad de hacer preguntas y yo pregunté en ese momento que cuánto afecta la llegada de un candidato de cierto partido en el presupuesto. Que si hay cambios, y ellos me respondieron que si, pero son leves. Que al final hay un consenso político en cuanto al presupuesto y que es difícil que cambie. 

Y eso me hace preguntar, ¿de verdad un presidente influye tanto en el país? ¿Sería el fin del mundo si en algún momento llegara un candidato de la extrema derecha o de extrema izquierda (en el mapa político chileno)? ¡Leo sus ideas!",https://reddit.com/r/RepublicadeChile/comments/1iomldv/creen_que_si_saliese_un_candidato_como_kaiser_o/
1ik25la,El gladiador de los chanchos,169,Maztinyer_3,165,2025-02-07 18:36:40,,https://reddit.com/r/RepublicadeChile/comments/1ik25la/el_gladiador_de_los_chanchos/
1ijw8dl,¿Desde cuándo no hablan?: La turbulenta historia de Kaiser y Kast,7,PanchoFalcato,8,2025-02-07 14:29:22,Resumen en RadioGrama: https://www.biobiochile.cl/especial/bbcl-investiga/noticias/de-pasillo/2025/02/07/desde-cuando-no-hablan-la-turbulenta-historia-de-kaiser-y-kast.shtml,https://reddit.com/r/RepublicadeChile/comments/1ijw8dl/desde_cuándo_no_hablan_la_turbulenta_historia_de/
1ijbo8f,"Senador Moreira (UDI): ""Digamos la verdad, Johannes Kaiser no va a ser Presidente de Chile""",11,MELERIX,28,2025-02-06 19:55:10,,https://reddit.com/r/RepublicadeChile/comments/1ijbo8f/senador_moreira_udi_digamos_la_verdad_johannes/
1ihwdl1,Ya parece elección bananera con tanto candidato,58,Maztinyer_3,32,2025-02-04 23:51:57,"Por si preguntan:
CHV- Chile Vamos
Republicanos
PNL (Kaiser)
Social Cristianos
PDG el de Parisi
Demo, amarillos (el partido de los fachos disfrazados de centro izquierda)
El oficialismo actual
PC-AP (el partido de Artés)
Partido Popular o Izquierda popular (tipo meo o ex listas del pueblo)
PEV (Ecologistas)",https://reddit.com/r/RepublicadeChile/comments/1ihwdl1/ya_parece_elección_bananera_con_tanto_candidato/
1if7vlm,"Jorge Coulon, el Inti Illimani que encara a Kaiser, defiende a Jadue y critica a la justicia en manos de una clase que perdió  la vergüenza",0,Maztinyer_3,22,2025-02-01 14:49:52,,https://reddit.com/r/RepublicadeChile/comments/1if7vlm/jorge_coulon_el_inti_illimani_que_encara_a_kaiser/
1ian3mj,Golpe en la derecha: Johannes Kaiser sobrepasa a Evelyn Matthei en nueva encuesta,29,Maztinyer_3,107,2025-01-26 19:04:01,,https://reddit.com/r/RepublicadeChile/comments/1ian3mj/golpe_en_la_derecha_johannes_kaiser_sobrepasa_a/
1i7s6a6,LLEGO LA GRANJA DE BOTS DE KAISER,0,ozzraven,16,2025-01-23 01:42:10,Ya los tengo a todos tageados pa futura referencia,https://reddit.com/r/RepublicadeChile/comments/1i7s6a6/llego_la_granja_de_bots_de_kaiser/
1i5u7dj,Creen que las divisiones en la derecha le van a jugar muy en contra?,14,Maztinyer_3,40,2025-01-20 16:30:59,"Tanto en parlamentarias como presidenciales, técnicamente hay 4 facciones de derecha para las próximas elecciones.
Hasta ahora la derecha va a tener 4 o 5 candidatos presidenciales
-Evelyn Matthei (Chile Vamos)
-José Antonio Kast (Republicanos)
-Johannes Kaiser (Independiente)
-Como 4 wnes en una primaria del PSC (pero lo más probable es que gane el Rojo Edwards)
- Quizas Parisi u otro wn creyendose de centro como demócratas o amarillos

Mientras que la izquierda parecerá que va a ir unida en la coalicion FA-PC-Concerta y su fanaticada del 25-30% va a votar por ellos si o si más el Artés y quizás Meo que estos 2 últimos no sacan grandes porcentajes que digamos.
Lo que estoy diciendo es que la derecha por sus disputas se va a pegar tremendo disparo en el pie

",https://reddit.com/r/RepublicadeChile/comments/1i5u7dj/creen_que_las_divisiones_en_la_derecha_le_van_a/
1i46hbw,"Johannes Kaiser: “No creo que Kast sea el original, pero fue un actor muy importante en la defensa de nuestros principios”",5,1750gt16,35,2025-01-18 12:25:11,,https://reddit.com/r/RepublicadeChile/comments/1i46hbw/johannes_kaiser_no_creo_que_kast_sea_el_original/
1hv4e26,¿Qué presidenciable ven ustedes que podría tener buenas ideas?,8,Malvido92,101,2025-01-06 17:25:31,"Este año son las presidenciales, así que ni estoy muy seguro de quien podría ser una buena opción. Hasta ahora ni conozco ningún candidatoal sillón, aparte del vende humo de Axel Kaiser; ni mucho menos a alguien decente para el puesto, pues al parecer no existe.

Edit.: Creo que mi teoría era cierta: ¡CHILE NO TIENE NINGÚN PRESIDENCIABLE COMPETENTE, Y TODOS VAMOS A MORIR!",https://reddit.com/r/RepublicadeChile/comments/1hv4e26/qué_presidenciable_ven_ustedes_que_podría_tener/
1hcr49q,Kaiser disponible para primarias y los acercamientos de Chile Vamos con Demócratas para la presidencial,9,Eimyx,29,2024-12-12 18:03:18,,https://reddit.com/r/RepublicadeChile/comments/1hcr49q/kaiser_disponible_para_primarias_y_los/
1h65drt,Kaiser anti energías limpias: “Las sacaría cascando (…) no tienen ningún impacto positivo en el clima”,55,Commercial-Ladder-42,168,2024-12-04 02:26:52,Este enfermo mental tiene muchos seguidores...,https://reddit.com/r/RepublicadeChile/comments/1h65drt/kaiser_anti_energías_limpias_las_sacaría_cascando/
1f3ng89,“¡Para con tu payaseo!”: Erika Olivera encara a Johannes Kaiser tras rechazo a moción de censura contra mesa de la Cámara liderada por Cariola,14,ozzraven,9,2024-08-29 00:10:12,,https://reddit.com/r/RepublicadeChile/comments/1f3ng89/para_con_tu_payaseo_erika_olivera_encara_a/
1dtilmo,Caso Conscriptos: Mamá de Franco Vargas increpó y se retiró llorando de comisión tras dichos de Johannes Kaiser,18,ozzraven,45,2024-07-02 11:32:37,,https://reddit.com/r/RepublicadeChile/comments/1dtilmo/caso_conscriptos_mamá_de_franco_vargas_increpó_y/
1dipw33,el milei shileno XD,88,ozzraven,22,2024-06-18 13:50:30,,https://reddit.com/r/RepublicadeChile/comments/1dipw33/el_milei_shileno_xd/
1cb64kp,"Johannes Kaiser sobre historial de Aldo Duque defendiendo narcotraficantes: ""Es una labor que no solamente es legítima, sino que es necesaria""",0,extremoenpalta,14,2024-04-23 15:31:23,,https://reddit.com/r/RepublicadeChile/comments/1cb64kp/johannes_kaiser_sobre_historial_de_aldo_duque/
1ba24ef,Anécdotas bizarras del Hospital Psiquiátrico El Peral,10,space_sleeper,5,2024-03-08 23:01:42,"Resulta que hace unos días me tocó dejar insumos por allá y pude verlo, jamás había ido. Vi el sector abandonado que se incendió hace unos años e igual daba unas vibes de miedo. Se me vino a la mente un relato que me contó cuando chico una señora evangélica ermitaña que fumaba mucha marihuana de que ella de joven le tocó visitar la institución y vio que en un patio donde solo podías mirar a través de un agujero los tenían desnudos y que la locura hacía que se les ensanchara la cabeza la frente (onda como los memes exagerados de Axel Kaiser) y que el resto de su cuerpo era escuálido a excepción del vientre que era inflado. Obviamente cuestiono ese relato tanto por el contenido como también por el estado psicológico de la persona que me lo contó xd. Y bueno, como el folklore se transmite popularmente les pregunto por aquí si conocen alguna historia o anécdota relacionada con este lugar. Déjenlo en los comentarios. Gracias",https://reddit.com/r/RepublicadeChile/comments/1ba24ef/anécdotas_bizarras_del_hospital_psiquiátrico_el/
1az1vw3,"Johannes Kaiser: ""Me arrepiento de haber escrito cosas descriteriadas (...), amo a las mujeres en general""",36,extremoenpalta,42,2024-02-24 18:42:03,,https://reddit.com/r/RepublicadeChile/comments/1az1vw3/johannes_kaiser_me_arrepiento_de_haber_escrito/
1an8wn8,literatura anti-marxista/Liberal,12,Derakaakared,30,2024-02-10 05:25:41,"Buena cabros, este verano me puse como propósito aprender filosofía, a estas alturas ya he leído y mas o menos entiendo a varios autores, pasé por Kant, Hegel, Locke, Rousseau y Marx. Sin embargo con este ultimo tengo problemas.  


Resulta que los Filósofos en muchos casos discuten entre ellos, para entender a uno tienes que entender su contexto histórico y los filósofos contemporáneos y anteriores para tener una visión mejor de sus ideas. Si quieres entender a Marx tienes que entender a Hegel y si quieres entender a Hegel tienes que entender a los filósofos de la rev francesa (Como Rousseau y Locke) y para entender a los filósofos de la Rev. francesa tienes que medio entender a los filósofos griegos.  


El punto es que me puse a Leer a Marx, resulta que varios de sus postulados me hicieron mucho sentido, así que me puse a buscar autores del ''bando contrario'' e idealmente una visión mas contemporánea, así que me puse a escuchar a los intelectuales de derecha para ver en quien basaron sus postulados... sin embargo no pude hacerlo. Por algún motivo casi todos estos (véase Axel Kaiser, Emanuel Dannan y Agustín Laje) Cuando se ponen a hablar de Marxismo en la mayoría de los casos tiran de falacias y MENTIRAS para refutar sus postulados, es francamente agotador ir y escuchar argumentos del tipo ''si tienes iphone no podes ser comunista''.  


Algo interesante sobre el Marxismo es que al ser una ideología revolucionaria esta muy en contra de los dogmas, al punto de considerarlos anti-revolucionario (obvio, una revolución es un constante cuestionamiento de lo establecido, por lo que entrar en dogmas seria totalmente anti-revolucionario) a su ves Vladimir Lenin dijo que ''la verdad siempre es revolucionario'' dando a entender que para el Marxismo SIEMPRE hay que cuestionarse aquello que se dice, incluso de los propios marxistas. 

Por lo que de buena fe quisiera preguntar (ya que este sub es famoso por tener a muchos usuarios de derecha) quienes son sus pilares intelectuales y donde saber mas de ellos. Idealmente canales de YouTube, libros o podcast que me puedan dar una mejor visión. Mi idea simplemente es escuchar diferentes fuentes, ver aquello que me haga mas sentido y por ende ir mas allá.",https://reddit.com/r/RepublicadeChile/comments/1an8wn8/literatura_antimarxistaliberal/
