id,title,score,author,num_comments,created,selftext,permalink
1lhqddm,La crujidera en el comando Matthei - La Tercera,2,1750gt16,1,2025-06-22 16:18:49,"El domingo 15 comenzó la crujidera en una de las casonas de Enrique Foster, sede del comando de **Evelyn Matthei**.

Pese a la veda de las encuestas, durante la tarde empezaron a llegar a los distintos WhatsApp los resultados de una medición confidencial que constataba que **José Antonio Kast** había superado -por sobre el margen de error- a la exalcaldesa. Un temor que venía rondando desde el 18 de mayo, cuando el abanderado republicano logró empatarla. Y que se sumó a otro menos confesado: que la exedil no logre superar la valla de la primera vuelta.

Esto, junto a versiones -en el marco de las *fake news*\- de que si Matthei continúa sin poder recuperar el primer lugar, que mantuvo en solitario por más de un año y medio, incluso se estarían considerando por lo menos dos nombres de empresarios para su reemplazo. Entre ellos, se nombra al expresidente de la CPC **Juan Sutil**, quien descartó tajantemente a La Tercera esa posibilidad.

“Yo no estoy disponible para ninguna candidatura de ninguna especie. Esto es una mera especulación, incluso, malintencionada”, sostuvo. Y añadió que nadie lo ha sondeado y que “alguien echó a correr un rumor para hacerle daño a Evelyn Matthei, a quien yo apoyo”.

En Chile Vamos hay quienes no descartan que así como se logró afectar en las encuestas la opción de **Johannes Kaiser**, abanderado de Nacional Libertarios, vía bots y la difusión de rumores a través de redes sociales, hoy Matthei se haya convertido en un blanco.

De ahí que el análisis en la reunión telemática de los voceros del domingo fuera especialmente agudo. Partiendo por tener una postura más dura frente a Kast. Algunos plantearon salir al paso del republicano sin diplomacias, porque -como lo graficó un parlamentario- “no es lo mismo la Coca Cola que la Pepsi Cola”. Y sacarlo al pizarrón en temas valóricos y de gobernabilidad. Otros, en cambio, sostuvieron que no hay que perder el foco y que el rival está al frente, en el oficialismo.

“El endurecimiento de posiciones o no frente a Kast es una visión que se da en una coalición como la nuestra. Pero eso no quiere decir que Kast vaya a ser nuestro foco. Nuestro objetivo, como centroderecha, es conquistar el voto de centro y de los independientes. Y las encuestas, si bien nos preocupan, son solo una foto del momento”, enfatiza la diputada RN **Ximena Ossandón**.

Esta última fue la postura que al final se impuso.

Pero en el bloque hay intranquilidad. Advierten falta de tonelaje político en una de las piezas claves de la campaña, el generalísimo **Diego Paulsen**, a quien se le cuestiona -en voz baja- por no tener experiencia en este tipo de lides. De ahí que el exsubsecretario **Rodrigo Ubilla** se haya sumado a ese equipo para colaborar con su estratégica visión, sin dejar de asesorar a Matthei.

La crítica más profunda es la falta de tracción en el discurso de la exalcaldesa, que no ha logrado permear a nivel ciudadano. Y, peor aún, que aparece deslavado frente a las drásticas propuestas programáticas de los republicanos, especialmente en seguridad.

No convence, asimismo, la estructura de 11 vocerías, que debutó en abril, para descomprimir la sobreexposición mediática de la exministra.

Sostienen que el modelo -conformado por los alcaldes **Mario Desbordes**, **Jaime Bellolio**, **Sebastián Sichel**, **Felipe Alessandri** y **Carol Bown**; los diputados **Diego Schalper**, **Jorge Alessandri** y **Francisco Undurraga**; las senadoras **Luz Ebensperger** y **Paulina Núñez,** y la exseremi **Francesca Parodi**\-, que fue ideado por Paulsen y aprobado por los presidentes de los partidos, no ha dado los resultados previstos. Y que un síntoma de que el asunto no iba a funcionar fueron los traspiés que registró desde sus inicios.

No solo por las declaraciones de la senadora RN **Paulina Núñez**, quien por plantear que estaban “trabajando para llegar a un Socialismo Democrático que se sentía huérfano”, hasta le pidieron públicamente su salida, sino que porque se estima que algunos no han logrado amplificar el mensaje. Y que incluso los alcaldes casi se han restado de ese rol, aunque desde el comando los defienden señalando que desde un principio quedó claro que no podían participar en actividades dentro de su horario laboral.

Y aunque se admite que el expresidente de la Cámara de Diputados ha puesto orden a nivel de los partidos y parlamentarios y tiene buena sintonía con Matthei, hacen ver que su discurso es tibio. Y que así quedó demostrado en *Tolerancia Cero*, del 9 de junio, en que para muchos no marcó diferencias sustantivas con republicanos.

Todos problemas que a cinco meses de la primera vuelta observan con extrema preocupación, pues sostienen que la avalancha electoral se les viene encima y que mientras más se acerque el 19 de noviembre, más difícil será recuperar el sitial.

# El difícil momento de Matthei

El último mes no ha sido fácil para Matthei. Menos la última semana. El lunes -a pesar de estar aquejada de una fuerte gripe- participó en el comité político, en el que se analizó en forma minuciosa el complejo momento por el que atraviesa la campaña y los escenarios que abren las primarias oficialistas.

Matthei se mostró tranquila. “Más que preocupación, hay ocupación”, dice un cercano. Otros sostienen que es evidente que las cifras la impactan y que se le nota en su rostro, pero que eso la enfoca más.

Su última instrucción -antes de irse a su casa por recomendación médica, que la mantuvo en reposo toda la semana- fue que el diseño sigue a firme; que el adversario es el oficialismo y que el foco va a estar puesto en las propuestas, en las giras a regiones y en activar las dirigencias y bases de Chile Vamos.

Su estado de salud la dejó fuera de una serie de compromisos, el más importante, el debate presidencial del jueves pasado de Enela en La Araucanía, zona clave en el tema de seguridad y donde la derecha tiene uno de sus mayores soportes electorales, al que sí asistieron Kast -aunque protagonizó un tenso momento cuando le cortaron el micrófono- y **Johannes Kaiser,** de Nacional Libertarios.

En su ausencia se comunicó la primera baja en su comando. **Carla Munizaga** \-histórica asesora del expresidente **Sebastián Piñera** y que se había integrado a la campaña de la exedil en marzo- dejó la jefatura de comunicaciones por motivos personales.

Pero esa área ya había tenido ajustes. El 9 de junio -cuando Matthei había perdido el liderazgo en los sondeos-, el periodista **Cristián Torres** \-quien forma parte de su círculo de hierro- dejó su rol como jefe de gabinete, cargo que fue asumido por **Carol Vargas**, exadministradora de la exedil en la comuna de Providencia, y volvió a comunicaciones junto a Munizaga.

El movimiento de piezas -ahora Torres asumió la dirección de Comunicaciones- fue interpretado como el reforzamiento de un área que venía siendo cuestionada por algunos integrantes de Chile Vamos por la falta de eficacia y de estrategia en los mensajes y por no prevenir temáticas complejas.

En ese equipo figuran -además de los periodistas de avanzada y terreno- el publicista **Patricio del Sante**, en el área de marketing, quien empezó a trabajar con agencias que se mantienen en reserva, y **Cristina Villagómez** en redes sociales, quien se sumó hace unos 10 días a la campaña, para un mayor despliegue digital y de piezas audiovisuales, área que se encontraba rezagada frente a la puesta en escena de los republicanos.

# Cambio posprimarias

La apuesta de Chile Vamos es dotar a la campaña de Matthei de un nuevo aire, tras los resultados de la primaria del oficialismo que se celebra el próximo 29 de junio, punto cero de la recta final.

Para Chile Vamos no es indiferente quién gane, aunque los cálculos están abiertos. Si se impone la exministra **Jeannette Jara** (PC) observan un escenario promisorio para la exalcaldesa, por los anticuerpos que podría generar su militancia comunista en el centro político. Pero también ven ahí opciones para Kast. Y si logra ungirse la exministra del Interior, **Carolina Tohá** \-abanderada PPD, PS, PR y PL-, hay quienes ven una mayor oportunidad para Matthei, ya que si Kast y Tohá se enfrentan en una segunda vuelta, puede producirse una reedición de la presidencial 2021, donde hubo un todos contra JAK, que terminó con **Gabriel Boric** en La Moneda.

A ello obedece que la decisión de Chile Vamos sea salir a conquistar el centro político y a los independientes que van obligados a votar y que están molestos por la falta de soluciones. Y hacer pesar la experiencia, moderación, capacidad de consensos y gobernabilidad de Matthei, conscientes de que su liderazgo hoy está amenazado por el auge de la derecha más dura.

También apuntan a dejar atrás tropiezos comunicacionales, como el haber hablado de “muertes inevitables” por el Golpe de Estado; por reinstalar la discusión sobre la pena de muerte al decir que “hay casos en que debiera aplicarse”, y el mandar a callar a la vocera de gobierno (S), **Aisén Etcheverry**. Un episodio que -de paso, dicen- debilitó a Paulsen, porque la exedil lo interrumpió en público.

La idea mayoritaria en su coalición base es que Matthei se aboque en los meses que restan de campaña a difundir las ventajas de su futuro gobierno y a estrechar su contacto con la ciudadanía, delegando en otros las temáticas de contingencia menor.

# Piñerismo versus ‘mattheísmo’

Si bien en las filas de Chile Vamos no existe un mattheísmo, pero sí un piñerismo, por los cientos de colaboradores que reclutó en sus dos gobiernos, hay quienes han planteado la necesidad de que la exalcaldesa empiece a estampar su propia marca.

Uno de ellos es el diputado UDI **Juan Manuel Fuenzalida**, desde hace años cercano a la exalcaldesa. “No es algo en contra del piñerismo, del que todos fuimos parte y nos sentimos orgullosos, pero cada etapa tiene su gente y su sello, y en esta presidencial, el mattheísmo es el que debe llegar a La Moneda. Y eso lo tenemos que hacer con el despliegue de toda nuestra infantería”, dice.

Lo anterior implica, a su juicio, centralizar las vocerías en la exalcaldesa y en Paulsen, e incorporar a la campaña al centro y a los independientes, porque “todos suman”.

Por lo pronto, Matthei sigue dando nuevos pasos. El jueves lanzó el sitio web “EM26″, que incluye los ocho primeros planes a trabajar en su propuesta de gobierno, en materia de combate al crimen organizado, destrabar la inversión, el crecimiento y la creación de buenos empleos, junto a medidas para frenar la corrupción pública y de políticas en salud, educación y vivienda. Esto, para ganar la batalla de las propuestas ante un rival que -según lo ha demostrado- no está dispuesto a una tregua.",https://reddit.com/r/RepublicadeChile/comments/1lhqddm/la_crujidera_en_el_comando_matthei_la_tercera/
1lgf4x0,Cerebro liso o cerebro galaxia?,0,Impress_Queasy,4,2025-06-20 22:08:20,"Planteese la siguiente situación, tu papá, dice que va a votar por el kaiser, y le dice constantemente a sus conocidos o a quien se cruce que voten por el.

Que le dices?, lo agarras a charchazos o lo dejas estar?",https://reddit.com/r/RepublicadeChile/comments/1lgf4x0/cerebro_liso_o_cerebro_galaxia/
1lcc8x0,La metamorfosis de Kast - La Tercera,3,1750gt16,6,2025-06-15 22:58:39,"Quiero decirles primero quién no soy yo: yo no soy (Donald) Trump, claramente soy más buenmozo, tengo más hijos y tengo mucho menos plata. También muchas veces me caricaturizan y dicen que soy racista y xenófobo, y tampoco lo soy”.

Hace ocho años, **José Antonio Kast** se presentaba así ante el auditorio de la Enade 2017 en CasaPiedra. Era su primera incursión a La Moneda y el entonces diputado -que el año anterior había renunciado a la UDI, entre otras razones por considerar que se había apartado de sus ideas fundacionales- necesitaba desvirtuar la ruda imagen que proyectaba. “Tampoco soy facho ni populista”, les dijo.

Pero no lo logró.

Sus tajantes declaraciones -en esa campaña- a favor del régimen militar terminaron por pasarle la cuenta, pues no solo afirmó en esa época que “si Pinochet estuviera vivo votaría por mí”, sino que visitó a los presos de Punta Peuco y sostuvo que ese régimen ”fue mejor” que el que había encabezado **Sebastián Piñera**, su principal contendor en la derecha, quien iba por su segundo periodo y que, a diferencia de él, había votado por el “No” en el plebiscito del ’88.

Hoy no habla de ese tema, como sí lo ha hecho la abanderada de Chile Vamos, **Evelyn Matthei**, con los consiguientes costos. Tampoco -o apenas- ingresa a materias sensibles. No ha vuelto a mencionar la derogación del aborto en tres causales -aunque sí ha criticado al gobierno por el proyecto que busca despenalizar el aborto hasta las 14 semanas-. Y no se ha referido de nuevo a su fallida propuesta para terminar con el Ministerio de la Mujer, a su oposición al matrimonio homosexual o a la discusión del que o quien está por nacer, que lo impactaron con la derrota en la presidencial del 2021 y, más doloroso aún, el fracaso del segundo proceso constitucional.

“Aprendimos a porrazos”, admite un integrante de su círculo.

En esta, su tercera y última carrera por la Presidencia, Kast ha mostrado que ha pasado por una metamorfosis. Está consciente de que tenía un techo electoral y el cambio -siempre calculado- apunta a esquivarlo. Su decisión es buscar a ese electorado insatisfecho, que quiere cambios drásticos, especialmente en seguridad, crecimiento y empleo. Y reducir al mínimo los errores. Una postura que le ha permitido en el último tiempo empatar e incluso superar -todavía en el margen de error- a Matthei, quien aparecía imbatible en todos los sondeos.

A su favor juegan dos factores. La irrupción de **Johannes Kaiser** de Nacional Libertarios, quien corrió las cercas de la derecha y lo situó -ante la ciudadanía- en una posición más moderada, y el cambio de vientos a nivel mundial y nacional en el sentido de un auge más claro de las ideas de derecha, sobre todo en el tema de la violencia y la migración.

También que el Kast de hoy no es el mismo que enfrentó a **Gabriel Boric** en el balotaje del 2021. Y cuyos adversarios admiten que esta vez sí tendría opciones de ganar.

En su entorno insisten en que no hay variación en las ideas, pero sí en la forma de abordarlas. Y en vez de “moderación”, prefieren hablar de “madurez”. Otros plantean que es puro pragmatismo. Y como ejemplo plantean el fichaje en su equipo del exalcalde de La Florida **Rodolfo Carter**, con quien no solo ha tenido diferencias políticas, sino que también por el cultivo terapéutico de la marihuana que impulsó el exedil. “Si el mundo hubiese actuado como plantea el diputado (Kast), sobre el prejuicio, la ignorancia y la intolerancia frente a lo nuevo, el hombre jamás hubiera salido de las cavernas”, le respondió Carter en 2015.

El líder republicano dejó de inmiscuirse en el último tiempo en peleas políticas al interior de la derecha -la última de proporciones que libró con Chile Vamos fue para la reforma de pensiones-, pero sí mantiene activa la manija de críticas con el gobierno y con la izquierda, pues el diseño de la “marca republicana” es presentarlo como su principal opositor.

“No ha habido un cambio significativo a nivel de propuestas, pero efectivamente su foco no es entrar al debate político menor, sino que centrarse en las cosas que realmente le importan a la ciudadanía”, sostiene **Ruth Hurtado**, secretaria general del partido.

El diseño apunta a mostrarlo como un estadista empático, un “padre protector” -una figura similar a lo que fue **Ricardo Lagos** para el Socialismo Democrático-; que hace propuestas y busca soluciones a los problemas que viven día a día los ciudadanos. De ahí que la defensa política -a nivel de contingencia- haya quedado en manos de **Arturo Squella**, presidente del partido.

“No lo van a ver bailando ni participando en la *Divina Comida*, porque su tarea no es esa, es resolver los graves problemas que tiene Chile”, cuenta un integrante de su equipo.

La fórmula le ha funcionado sin contratiempos, pues a diferencia del comando de **Evelyn Matthei,** quien debe alinear a la UDI, a Renovación Nacional y a Evópoli, ellos son un solo partido.

# Una máquina aceitada

Apenas terminó la campaña para la elección municipal y de gobiernos regionales de octubre pasado -que no tuvo los resultados esperados para los republicanos-, la sede de Las Condes se activó en modo presidencial.

Los encargados de dar la partida fueron los integrantes del círculo de hierro de Kast, integrado por **Arturo Squella**, presidente del partido, a cargo de las líneas político-estratégicas; el abogado y consejero **Cristián Valenzuela** y la periodista **Carolina Araya**. Todos vienen de la campaña de 2017.

El primer paso fue elaborar una hoja de ruta con todas las temáticas a levantar cada semana hasta la primera vuelta, con flexibilidad para ingresar a la grilla temas de contingencia, como el asunto de las 25 mil licencias médicas utilizadas por funcionarios públicos para viajar fuera del país y que fueron denunciadas por la Contraloría. Nunca las primarias estuvieron en el mapa.

La operativa es simple. Kast se junta todas las semanas con el equipo para terminar de afinar la propuesta de la semana siguiente, en una reunión en la que participan Squella, Valenzuela, Araya; **Carmen Soza**, directora ejecutiva de Ideas Republicanas, y **María Jesús Wulf**, subdirectora de Acción Republicana. Más el creativo **Felipe Costabal**, y el director audiovisual **Adiel Ayala**, a cargo de los videos. El despliegue territorial está a cargo de **Alejandro Irarrázaval**, extesorero de la UDI y actual socio y gerente de la Agrícola Chacabuco.

Los viernes se les comunica lo que van a hacer a los parlamentarios y directivos; el domingo se les envía una minuta, y el lunes -antes de dar a conocer el tema a la prensa- se reúnen una hora antes para efectos de coordinación.

En un principio los temas no tenían nombre. Pero para esta presidencial optaron por bautizarlos. Así nacieron -entre otros- el Plan Zero Listas de Espera, que no tuvo en un principio mayor repercusión, pero que siguió con otros que sí tomaron vuelo, entre ellos el Plan Escudo Fronterizo, el más difundido; el Plan No Más Contribuciones para la primera vivienda; el Plan Auditoría Total, Plan Tu Casa, Plan Renace Chile y el Plan Patines para recuperar la educación pública, que fue el último.

“Todas las semanas nos pide, además, incluir un tema en seguridad, que es clave para él”, comenta una fuente, quien agrega que solo se trata de planes y no de un programa de gobierno. Este último -aseguran- va a ser bastante más breve que el de 2021, que por su amplitud y detalles terminó ocasionándoles un problema.

Otra de las instrucciones de Kast es no celebrar el alza en las encuestas, para no generar fricciones en la derecha. Aunque sigue un monitoreo exhaustivo de las cifras. De hecho, las sube todas a su cuenta X, las buenas y las malas.

La que más expectativas generó fue la del 25 de mayo -que venía justo una semana después del primer empate a 17 puntos con Matthei-. Ese día, Kast iba en un vuelo rumbo a Madrid y luego a Budapest, por lo que hubo varias horas de silencio informativo. Durante el viaje leyó el libro *Tiempos Mejores*, de **Jorge Selume**. Y cuando recuperó la señal y recibió los resultados, que daban cuenta de un empate técnico -17 a 16 entre Matthei y él-, el análisis fue que las cifras no obedecían a un asunto circunstancial. Estaban marcando una tendencia. Pero no celebró. “Las encuestas pasan, los proyectos quedan”, estampó en un posteo.

No estaba errado. El 8 de junio superó a la exalcaldesa -por primera vez- por un punto.

La mejora en los guarismos le ha dado una nueva energía, comentan sus cercanos. Dedica gran parte de su tiempo en el partido a estudiar en profundidad los temas; se reúne en su oficina con distintos especialistas (los que se mantienen en reserva para no acarrearles dificultades), al tiempo que se alimenta sano y hace mucho ejercicio. “Ha bajado varios kilos, con una rutina diaria con un *personal trainer*”, cuenta un integrante de la casona de Presidente Errázuriz.

# Asesoría internacional

De todos los presidenciables de esta contienda, Kast es el que registra el mayor despliegue en el exterior. Su objetivo es conocer modelos exitosos en seguridad y estrechar lazos políticos especialmente con el mundo conservador. El último viaje lo hizo esta semana a Asunción, Paraguay, para participar en el Foro Madrid, desde donde cuestionó a la izquierda.

Los podios internacionales son los preferidos para sus críticas políticas. En Hungría, el año pasado, sostuvo que “estamos gobernados por un Presidente *woke*”. Y a fines de mayo de este año, de nuevo en Hungría, en la CPAC (Conferencia Conservadora), cuestionó de nuevo al gobierno del Presidente Boric -por el ingreso de 120 mil ilegales, según dijo- y también al de Piñera.

“No es un problema solo de la izquierda, la derecha tradicional, cuando gobernó, tampoco supo enfrentar con fuerza la inmigración ilegal”, sostuvo.

Kast -se comenta- ha observado con atención ejemplos como el de **Viktor Orbán**, quien se ha mantenido 15 años como primer ministro de Hungría, sin tocar proyectos progresistas como el aborto. Y ha mezclado su accionar político con visitas de aprendizaje, en las que privilegia el contacto con los encargados de áreas.

El año pasado estuvo -entre otros- en El Salvador para conocer la “megacárcel” contra el crimen organizado, creada por el Presidente **Nayib Bukele**; en Italia visitó una dependencia penitenciaria para los cabecillas de la mafia; en Inglaterra se interiorizó sobre la implementación de un sistema de cámaras, y en Hungría visitó la valla fronteriza con Serbia, para construir un símil en Chile en el límite con Bolivia.

Por lo pronto, en las filas republicanas se mantiene la hoja de ruta sin variaciones hasta la primera vuelta.

No van a nombrar un comando antes de la inscripción del 18 de agosto y la decisión es evitar fricciones con Chile Vamos, ya que saben que ambos bloques se necesitan en una segunda vuelta y no quieren una reedición de la pugna 2021, que terminó con un **Sebastián Sichel** restándose del apoyo a Kast en el balotaje que terminó con **Gabriel Boric** en La Moneda. De ahí que Kast ya adelantó un apoyo sin condiciones a Matthei, con la convicción -dicen- de que esta presidencial se gana por la derecha.

",https://reddit.com/r/RepublicadeChile/comments/1lcc8x0/la_metamorfosis_de_kast_la_tercera/
1l2u4yv,El miembro de la familia Kaiser más democrático:,71,Maztinyer,38,2025-06-04 03:15:24,,https://reddit.com/r/RepublicadeChile/comments/1l2u4yv/el_miembro_de_la_familia_kaiser_más_democrático/
1l0uy4f,"Kaiser abandona cuenta pública tras anuncio de Boric por ley de aborto: “Habla de unidad, pero miente, nos insulta” - La Tercera",75,Maztinyer,89,2025-06-01 18:41:42,,https://reddit.com/r/RepublicadeChile/comments/1l0uy4f/kaiser_abandona_cuenta_pública_tras_anuncio_de/
1kz3amg,Por quién votar?,0,Frequent-Creme-8442,149,2025-05-30 13:45:05,"Mi situación es que no vivo como hace un año en Chile y voy a volver justo para votar. En verdad de Chile solo veo noticias de fútbol, así que pico idea de cómo está la situación aparte de los V. Pero asi enserio por quién es mas sensato votar por la Matthei, Kast o el chancho Kaiser, porque de izquierda mejor ni hablar.

Salu2.",https://reddit.com/r/RepublicadeChile/comments/1kz3amg/por_quién_votar/
